keywords,score
一个博物院就是一所大学校,0.008441925048828125
蜂花,0.00946265459060669
高校追回多名已毕业研究生国家助学金,0.06157064437866211
博物馆文物出现在生活里会怎样,0.008948922157287598
外卖被拿走的饿了么订单当事人回应,0.9938862919807434
林妙妙钱三一牵手了,0.00843667984008789
315曝光土坑酸菜厂被罚55万,0.9941667318344116
澳门酒店双女尸案告破嫌疑人落网,0.994175374507904
大宋少年志2原班人马回归,0.010388970375061035
郑秀妍张天爱吴谨言女团舞,0.008439362049102783
初婚平均年龄普遍推迟,0.9938437938690186
蜂花主播说没见过这么大场面,0.012344419956207275
重生之门,0.008640110492706299
官方通报杭州金沙湖地铁站进水,0.9941008687019348
被云南的零食馋哭了,0.02592402696609497
邻水封控区孕妇临产交警开道护送,0.9937798380851746
林更新演技,0.008499860763549805
腾讯起诉vivo不正当竞争,0.9941841959953308
庄文杰西装,0.008469104766845703
44岁牺牲交警生前最后一刻画面,0.9937630295753479
天津春季高考6月12日举行,0.008400797843933105
乘风破浪启航曲MV,0.010770738124847412
一发言就紧张要怎么办,0.9941233992576599
俞敏洪称很多年轻人没有退身之所,0.021557211875915527
河南村镇银行取款难储户发声,0.9938260912895203
杨紫成毅沉香如屑即将上线,0.009014248847961426
中餐厅6将回归大自然,0.009116828441619873
520男生最想收到的礼物,0.00871741771697998
中国妇女报评妇炎洁低俗广告,0.994144856929779
小象莫莉在妈妈陪伴下隔离观察,0.028205156326293945
俄罗斯饮料制造商推出本土版可乐,0.3909687399864197
2022优酷大剧片单,0.008681237697601318
中国人1000多年前就把跳水玩出了花,0.009163856506347656
找赵继伟要喜糖,0.009550750255584717
被一只小狗给治愈了,0.010614275932312012
一见钟情的正确打开方式,0.008541643619537354
明日零时起北京公交启动乘车码升级服务,0.008685052394866943
陈妍希跳刘畊宏女神操,0.008853137493133545
杭州地铁1号线金沙湖站暂时不停,0.010698258876800537
婴儿被兔子咬断手指交警4分钟送医,0.057576894760131836
谭松韵发长文告别宁檬,0.008543074131011963
去有风的地方官宣阵容,0.008517086505889893
77岁奶奶轻松完成20多个引体向上,0.03441661596298218
上海6人哄抬物价被采取刑事强制措施,0.9941714406013489
谁能拒绝粉色的冰墩墩,0.012908935546875
天津新增19名阳性感染者,0.9934752583503723
刘洲成,0.0085563063621521
这居然是黄奕,0.012718617916107178
沉迷于搞反华小圈子没有出路,0.992095947265625
下饭还得是辣椒炒肉,0.010816216468811035
当代年轻人恋爱式找工作图鉴,0.008668899536132812
读懂百年大党的青春密码,0.010091543197631836
夸克,0.008613169193267822
上海口岸外贸逐渐企稳,0.0089951753616333
林更新说陆既明你怎么能让女孩子主动呢,0.009213626384735107
刘亦菲许红豆说她需要一个假期,0.00935518741607666
赵继伟婚礼现场,0.008931159973144531
北京有病例近期一直未参加核酸筛查,0.7133284211158752
42年前的今天中国有了自己的洲际导弹,0.008416712284088135
整个工地除负责人外全参与监守自盗,0.9941843152046204
央视起底寄拍模特骗局,0.9941917061805725
救猫的想法有点多余了,0.7798723578453064
谢谢每个平凡的守沪者,0.009177207946777344
对话北京房山封控区核酸检测队长,0.02536630630493164
黄晓明殷桃加盟中餐厅6,0.00854867696762085
伴舞,0.008518815040588379
重庆坠沟大巴车人员已全部送医,0.9909853935241699
崩坏IP新游开测,0.994192898273468
任豪说不找借口真诚道歉,0.010629892349243164
请叫我总监大结局,0.009400665760040283
丁真加入天天向上,0.008868753910064697
杭州金沙湖地铁站进水,0.994032084941864
寄拍模特批量生产买家秀,0.021997272968292236
榴莲这么小却这么懂事,0.013121306896209717
官方回应河南4家村镇银行取款难,0.9908739328384399
孙策520挚爱之约皮肤,0.008547186851501465
北京丰台新增27例感染者,0.991707980632782
郑秀妍镜头,0.008630573749542236
2022国际博物馆日,0.008327186107635498
人类或将面临二战后最大粮食危机,0.9941126704216003
任豪方回应做核酸时插队,0.9941463470458984
重庆城口一大巴车翻入河沟,0.0731469988822937
保时捷公布减配解决方案,0.016383647918701172
中国好邻居今天回家了,0.00997239351272583
花少团首次同框,0.010426938533782959
王者荣耀,0.00854802131652832
萧敬腾成都,0.013214528560638428
大宋少年志2,0.009085655212402344
赵继伟婚礼堪比CBA全明星,0.008939564228057861
消防员给13000只小鸡冲凉降温,0.012944340705871582
乘风破浪定档520,0.009907782077789307
北京理工大学房山分校列为风险点位,0.9931029081344604
光喝咖啡不喝水也会困,0.9919527173042297
小姨给未出生的宝宝缝百家被,0.012611806392669678
去有风的地方概念海报,0.008799076080322266
北京海淀新增7例确诊,0.009716629981994629
腾讯发布2022年一季度财报,0.009209990501403809
你好星期六拟邀常驻嘉宾名单,0.008718371391296387
杨丽萍刷视频选中的舞蹈女生回应,0.9925355911254883
重庆队全体员工讨薪,0.9936206936836243
大妈40秒内3次违反交规被撞飞担全责,0.9941934943199158
北京5月19日起区域核酸筛查安排,0.010045886039733887
TFBOYS粉丝戴面具开演唱会,0.009577751159667969
记郭艾伦账上,0.009959757328033447
北京新增49例本土感染者,0.7940152883529663
赵继伟助攻张镇麟抢到手捧花,0.009553074836730957
互发红包上百次分手后男子要女友还钱,0.9941059350967407
小奶猫获救后钻到消防员怀里,0.014574170112609863
中戏2018级表演系今日毕业答辩,0.008592426776885986
长安十二时辰发布第二季概念海报,0.009162485599517822
云南边境惊现墓地赌场,0.9941416382789612
这小肚子不扁下去是不行了,0.9941853880882263
赵继伟婚礼,0.009176492691040039
北京社会面仍发现零星散发病例,0.9941984415054321
天天向上NEWTRO兄弟团官宣,0.008567214012145996
五角大楼公布UFO画面,0.10808789730072021
北京第338场疫情防控新闻发布会,0.9030749201774597
感情中的自信太重要了,0.013881444931030273
天津核酸,0.011370182037353516
离沪证明6小时内有效,0.008513450622558594
泽连斯基在戛纳电影节开幕式视频演讲,0.008811593055725098
老干部白衬衫有多帅,0.009058773517608643
人民日报海外版点赞国风舞剧,0.008942127227783203
不明病因儿童肝炎病例因何异常增多,0.9941972494125366
5岁萌娃患地贫2年术后皮排致全身溃烂,0.9941304326057434
金曲奖,0.008404791355133057
全员加速中有望重启,0.008889317512512207
王俊凯在导演心中就是庄文杰,0.008882284164428711
85后夫妻裸辞回村造梦中小院,0.9937114715576172
医生飞奔救人重摔在地仍爬起接诊,0.994076132774353
原来小猪也有跳水比赛,0.015640437602996826
4种结直肠癌的检测方法,0.9938040971755981
老年智能手机大赛奖品是蒙古包,0.027727782726287842
11岁独腿女孩梦想成为假肢师,0.01471245288848877
中国博物馆的国宝图鉴,0.00842297077178955
合肥市副市长姚凯被查,0.9933423399925232
00后为什么敢于硬怼老板,0.9923966526985168
战至巅峰,0.00866609811782837
生命线上的摆渡人,0.011804461479187012
胡歌吴磊不虚此行芭莎大片,0.008666694164276123
出租车司机按收音机频道计费,0.9845332503318787
赵睿,0.008465826511383057
2022湖南卫视芒果TV大剧片单,0.009181082248687744
吵架后要用亲亲确认和好,0.38842684030532837
故宫研究员说甄嬛穿错衣服了,0.32797855138778687
这就是街舞5拟邀嘉宾名单,0.009526312351226807
5岁萌娃患地贫2年术后皮排致全身溃烂,0.9941304326057434
良辰好景知几何 回家的诱惑,0.008781731128692627
甘肃发现两千年前汉代木制长城,0.00876075029373169
北京海淀一小区出现十混一阳性,0.9937459230422974
年轻女孩租房2年未扔垃圾,0.011960089206695557
闪耀暖暖,0.00934535264968872
金赛纶酒驾现场图,0.009478330612182617
刘芸把家打扮成了花园,0.009245216846466064
2022湖南卫视芒果TV双平台招商会,0.009242832660675049
最想安利的练习室TOP1,0.008747994899749756
公司回应司机按收音机频道收费,0.9940606951713562
俄计划讨论退出世贸和世卫,0.9882432818412781
西藏发现迄今中国最高树木,0.008395493030548096
赵继伟伴郎团,0.008737921714782715
袁娅维入围金曲奖最佳女歌手,0.008731603622436523
20220518是第46个国际博物馆日,0.008424699306488037
上海快递已恢复至日均百万单,0.00986325740814209
建议将婚恋教育纳入中高等院校教育体系,0.010265588760375977
外星人,0.9797913432121277
夫妻之间明算帐是什么体验,0.9855875968933105
LOL新英雄虚空女皇,0.993474543094635
上海南京路步行街正在逐步复苏,0.009346961975097656
天津地铁,0.00852888822555542
2022KPL夏季转会期,0.009049177169799805
物理常识应是青年人标配,0.009165406227111816
重生之门王俊凯原声独白,0.009621024131774902
vivi发微博,0.9884870052337646
微信砍掉性能检测工具,0.6318094730377197
中国民航局回应美媒报道,0.19746124744415283
首位虚拟人入职中国文物交流中心,0.9920690059661865
秦岚聂远再演夫妻,0.010125517845153809
喜欢你我也是,0.008561909198760986
郑业成新剧沉浸式催眠,0.9941937327384949
与君初相识恰似故人归收官特辑,0.008728325366973877
瞬息全宇宙,0.9938952326774597
熊猫血男子为能随时献血自律20年,0.03758835792541504
傻狍子卡护栏获救后歪脑袋装死,0.9940896034240723
残疾大哥创业年销超百万,0.9941195249557495
俄称亚速钢铁厂内乌军和亚速营已投降,0.9938699007034302
2022湖南卫视芒果TV大剧片单,0.009181082248687744
金赛纶酒驾,0.01268702745437622
被人类幼崽的一句话治愈,0.009197890758514404
胡歌说你好闻善交个朋友吧,0.008473694324493408
王一博洛阳博物馆推广大使,0.008732616901397705
巴特勒41分,0.009011805057525635
小奶狗太可爱男子偷3只后自首,0.9855696558952332
重生之门洛神案今晚开启,0.0103415846824646
假赛,0.010850012302398682
马斯克盛赞微信,0.008637845516204834
李易峰把暗夜行者演出了喜剧效果,0.010018646717071533
电影不虚此行官宣新阵容,0.009053945541381836
游戏里让你印象最深刻的cp,0.009293735027313232
男朋友能有多要强,0.009112238883972168
电视剧传家,0.009327888488769531
苏州新增2例本土无症状感染者,0.02544611692428589
瑞典和芬兰拟联合提交加入北约申请,0.010045051574707031
周深欢迎光临主题曲,0.008483290672302246
你为什么腰痛,0.9938667416572571
阴阳师,0.00995779037475586
上海宠物方舱首批宠物出舱,0.008771896362304688
wland,0.014577984809875488
热火1比0凯尔特人,0.009852707386016846
上海新增96例本土确诊759例本土无症状,0.5095201730728149
巴特勒抢断,0.9889699220657349
俄乌冲突致英国炸鱼薯条店成批倒闭,0.9941146969795227
乘风破浪芭莎扬帆视频,0.00990307331085205
人为什么要逛博物馆,0.010404050350189209
今年一季度需求量较大职业排行,0.009544193744659424
狗狗被养报废车内女子连续投喂半月,0.9941585063934326
中国奶协回应网传割青麦作饲料视频,0.994093120098114
几十块钱的护肤品有好用的吗,0.011529088020324707
聊天记录,0.009098529815673828
山西忻州3.2级地震,0.05663597583770752
四川新增本土确诊49例,0.008997976779937744
爷爷倒车意外从3岁孙子身上碾过,0.011992096900939941
刘畊宏直播,0.008746325969696045
北京朝阳区连续五天实现社会面清零,0.008454620838165283
人生若如初见已过审,0.01333838701248169
赵露思演技,0.9637631773948669
G2,0.008534729480743408
北京5月17日新增52例本土确诊,0.009919464588165283
使命必达的东风快递硬核上分,0.008852362632751465
陪儿子减肥儿子没瘦爸爸瘦60斤,0.015775084495544434
侦察官兵执行任务营区幼犬执意跟随,0.01209169626235962
熊豆,0.008967220783233643
上海一骑手凌晨无偿接送路人,0.9931769371032715
深圳地铁,0.008432567119598389
美国国会就UFO问题举行听证会,0.12343573570251465
苏醒发文回应蘑菇屋为什么能火,0.01235342025756836
天津新增36名阳性感染者,0.993634819984436
美国海外生物实验室成灾难源头,0.9941006302833557
做核酸前30分钟内别喝热水,0.01997089385986328
MSI对抗赛赛程,0.008460819721221924
广州移动回应为亡母注销手机号被告知需本人办理,0.9941755533218384
北京朝阳第17轮区域核酸筛查结果均为阴性,0.9937845468521118
古诗词里的高山云海有多绝,0.008568942546844482
还珠3主演为黄奕乘风破浪加油,0.0100785493850708
夏天的头皮能不能别痒了,0.028029143810272217
天津增16例本土确诊39例本土无症状,0.7404513955116272
NBA抽签,0.008401989936828613
多国独立记者因真实报道俄乌冲突被解职,0.9898393154144287
洗衣液奶茶下架,0.9911344051361084
文物表情包斗图大赛,0.009683310985565186
李润祺直播,0.008693277835845947
2022NBA选秀,0.00846254825592041
5月17日新增本土确诊227例,0.010201454162597656
北京2022体育中考调整为合格性考试,0.009432613849639893
王者荣耀孙策大乔海报,0.008786976337432861
张杰说最后一期来接谢娜回家去,0.009308397769927979
丰兰息只剩十年寿命,0.9941186904907227
张一山 萌探探探案,0.040165722370147705
男子花14万5想娶外国媳妇被骗,0.9941085577011108
魔术获得状元签,0.009246468544006348
这就是街舞5招商名单,0.009912312030792236
小伙脚踏两条船不料对象是同一男子,0.991578221321106
新疆出现报春花海似紫色地毯,0.3943353295326233
研究称iPhone关机后仍在运行,0.010250389575958252
后背赘肉保不住了,0.9940556287765503
上海多人加价倒卖离沪火车票被抓,0.9941242337226868
北京多家商场暂时闭店,0.9939362406730652
芬兰议会同意申请加入北约,0.008603394031524658
女子80万存多家村镇银行1个月无法取出,0.9924963712692261
北京丰台全区非必要不出区,0.9905149936676025
Uzi,0.008875727653503418
北京疫情防控正处于紧要关头,0.021269500255584717
周杰伦5月20日将举办微信视频号演唱会,0.008711099624633789
妇炎洁涉事产品已下架,0.9941554069519043
MIC云合体,0.008430659770965576
且试天下编剧,0.008845329284667969
再困也要陪主人起夜的狗狗,0.9940608143806458
汽车下乡政策6月初有望出台,0.9478675723075867
冠军教练阿布谈EDG夏季赛调整,0.009774625301361084
凌智用矿泉水瓶制作健身器材,0.01796877384185791
赵泳鑫声音,0.008738160133361816
没有工作的一年,0.9879071116447449
窃贼被抓时正在网吧看普法节目,0.9941408038139343
拳头游戏发布公告,0.013113319873809814
KPL选手为什么没有女生,0.010964691638946533
蓝朋友教你科学减掉小肚腩,0.01060396432876587
商务英语学生接英文诈骗电话流利反击,0.9941657781600952
谢谢甄嬛,0.012087762355804443
杨幂为郭采洁加油,0.010082542896270752
美丽的他,0.008356153964996338
叁乔居,0.008673369884490967
去年3成流动人才月收入超8千,0.011007606983184814
粉色冰墩墩,0.01569366455078125
被馋到转圈圈的狗狗,0.018128633499145508
北京一涮肉店老板接待31人堂食被行拘,0.9941114783287048
没有工作的一年,0.9879071116447449
vivi说永远是刘畊宏女孩,0.011398017406463623
全网目睹杨丽萍在线选人,0.00922691822052002
美国国会就UFO问题举行听证会,0.12343573570251465
连博物馆都这么卷了,0.015612006187438965
郭艾伦抵达三亚,0.009629428386688232
唐山发生一起重大刑事案件,0.9941458702087402
高诗岩晒郭艾伦孤独背影,0.9941629767417908
