keywords,score
劳动是一门人生课,0.01117849349975586
你的身体比你想象中更爱你,0.009152650833129883
演员片酬等劳务收入不得用现金支付,0.9938250780105591
嫦娥五号部分科学数据公开发布,0.011072754859924316
研究生跟骗子通话3小时被骗74万,0.9941978454589844
刘畊宏女孩,0.008696436882019043
南航机务人员因说机长再见被通报,0.03126293420791626
佛山一个镇的小学生都能躺着午休,0.029184162616729736
2022年全国高考6月7日至8日举行,0.008385777473449707
外卖小哥上非诚勿扰相亲,0.10241985321044922
原来清华校名出自这首诗,0.00923299789428711
南开大学,0.008375346660614014
为什么年轻人看不上星巴克了,0.9654891490936279
李嘉诚杀回内地土拍市场,0.016037821769714355
XYG,0.008575975894927979
情侣觉得外省公安不行跨省偷10多家店,0.9941473007202148
我国每4个人中就有1人口臭,0.9941765069961548
全网等比亚迪一个回应,0.010033249855041504
女子拿到赔偿金主动退还司法救助金,0.9317671060562134
高三努力的意义到底是什么,0.010105669498443604
男团vocal的高音有多绝,0.0111083984375
演员片酬等劳务合同须以本人名义签订,0.0287514328956604
演员聘用合同示范文本发布,0.008785009384155273
熬夜太多会口臭,0.9940769672393799
母亲节表情包,0.88409423828125
太原重点场所将查验5日内核酸阴性证明,0.9531239867210388
长沙比亚迪工厂,0.009079575538635254
赞多在舞社点评舞台精确到度数,0.008701026439666748
莫斯科举行红场阅兵总彩排,0.00954127311706543
石家庄大叔带近20本房产证替儿子征婚,0.009456813335418701
小狗第一次坐船有多紧张,0.9940049052238464
中国农大一离校居家学生感染,0.9939631819725037
女子被抓竟在派出所跳本草纲目,0.9940420985221863
90后种出玫瑰花形状多肉年入百万,0.009586870670318604
郑州保供24小时,0.008689641952514648
间谍过家家,0.9941136240959167
黄锐直播,0.010519742965698242
女子实名举报公职丈夫出轨家暴,0.9941605925559998
北京1人为买奶茶翻墙离开管控区域被拘,0.9940312504768372
风起陇西大结局,0.008872032165527344
一封写给妈妈的情书,0.6489288210868835
北京疫情处在高位平台期,0.02114105224609375
比亚迪回应长沙工厂污染事件,0.9941115975379944
母亲节文案,0.3516539931297302
间谍过家家约尔cos,0.9927133917808533
切尔西vs狼队,0.9769894480705261
男子离婚后再结婚为何被判重婚罪,0.9940193891525269
文旅局调查脱口秀演员侮辱高校女生,0.9941587448120117
北京新增78例本土感染者,0.14753013849258423
萌探探探案,0.0256081223487854
窦骁演的萧北辰,0.0111464262008667
走进老区看新貌,0.008539438247680664
碧桂园,0.008270204067230225
电视剧好好说话,0.008356809616088867
姜受延去世,0.9940599203109741
王亚平古筝演奏李贺的梦天,0.008522093296051025
精简护肤的正确打开方式,0.008943796157836914
一个穴位缓解口臭,0.012379109859466553
韦东奕,0.008685171604156494
南方迎入汛来最强降雨,0.01050955057144165
极狐,0.15881061553955078
大家保险被曝4个月修丢客户多台车,0.9938919544219971
我国尚未发现不明原因儿童急性肝炎相关病例,0.993770182132721
唱到心里的OST歌曲,0.014071166515350342
新居之约佛系排播,0.009454607963562012
中国驻塞尔维亚使馆悼念3位烈士,0.012660384178161621
青年成长手册,0.008655905723571777
北京丰台一流动代开药点进管控区,0.008697271347045898
用榜样的力量引领前行,0.008740365505218506
请叫我总监林更新谭松韵直播,0.008862078189849854
椰青瀑布拿铁,0.009948194026947021
07快男 花儿与少年,0.010087430477142334
精简护肤的正确打开方式,0.008943796157836914
清华教授建议建设2000所县域大学,0.00848388671875
全球最大纸浆生产商警告随时断供,0.9940656423568726
益禾堂致消费者的一封信,0.012373745441436768
阿姨不听劝偷偷加回网恋对象被骗,0.9941755533218384
快播被吊销执照,0.994195818901062
妈妈真的会爱的母亲节礼物,0.010526955127716064
打卡南京5处绝美落日观赏地,0.008496522903442383
一位聋哑老人的抗疫故事,0.994139552116394
快递小哥封控区送货每天走5万步,0.031828343868255615
动物园回应女子拍玻璃引狒狒暴怒撞头,0.99418044090271
男子违规捕鱼前妻拍视频炫耀,0.9941495656967163
2022高考倒计时海报,0.009027600288391113
最不便利的便利店,0.99400395154953
再白的骨头汤也不能补钙,0.9941552877426147
刘子枫去世,0.9165218472480774
山东专升本计算机,0.008738160133361816
韦神都取得过哪些成绩,0.009807229042053223
大蛇钻进电动车被灌一斤白酒才现身,0.5744879245758057
男子摸黑上厕所不慎掉入茅坑,0.9941978454589844
泰式冬阴功瀑布拉面有多绝,0.00878828763961792
正确的喝水好习惯,0.008444249629974365
电诈嫌疑人回国后自述在缅北经历,0.9941492080688477
全国各地有哪些宝藏饮品,0.00977790355682373
母亲节文案,0.3516539931297302
FMVP们卷起来了,0.009860455989837646
朝阳区一确诊病例隐瞒行程被立案,0.9941847920417786
萌探探探案2把家有儿女集齐了,0.0087965726852417
封控区孕妇腹痛社区书记5分钟送医,0.9938281178474426
2024年陕西将全部取消普通高中跨区域招生,0.01792919635772705
嫌车辆停放影响跳舞大妈划伤数辆奔驰,0.9941313862800598
拍毕业照时男生对身高的执念,0.013812005519866943
阴阳师神堕八岐大蛇,0.9941641688346863
近200位房东自发烧好菜送给隔离租户,0.020743608474731445
vox,0.011118113994598389
浙江一小学师生共同设计午休椅,0.01022249460220337
新游记全员为一顿火锅抓马内讧,0.9941389560699463
沈阳新增7例核酸检测结果异常人员,0.9940610527992249
女子停车6天车内现5只小奶猫,0.02211940288543701
战疫要做到这三个坚决,0.524207353591919
RNG战队MSI巡礼,0.008579730987548828
北京新增社区筛查8例,0.014214813709259033
带薪团建吃烤肉有多爽,0.009029865264892578
Angelababy风起陇西今晚收官,0.009558916091918945
上海高考延期,0.013735473155975342
泽连斯基称与俄沟通外交渠道全中断,0.9936472773551941
公司要求员工放假隔半小时看次手机,0.011242449283599854
北京第327场疫情防控新闻发布会,0.32805871963500977
湛江市坡头区一地调整为中风险地区,0.987684965133667
内蒙古多地现巨型日晕,0.019211113452911377
百果园致歉,0.008493244647979736
新郎独自骑电动车接回新娘获全网祝福,0.00931936502456665
为什么南京是吃鸭子的骨灰级玩家,0.02721172571182251
悬赏10万重大刑案嫌犯孙武被擒,0.99410480260849
MSI开赛倒计时3天,0.008776426315307617
13岁单亲女孩误服农药或面临截肢,0.9941222071647644
西班牙发现奥密克戎新亚型BA.5病例,0.9936090707778931
一张出入证方便管控区癌症患者就医,0.025191068649291992
男子参加婚宴后为泄愤高空扔酒瓶,0.9941737055778503
成为妈妈要克服多少困难,0.9916865229606628
北京现有20地高风险34地中风险,0.9941133856773376
谷爱凌登奥林匹克官方海报,0.008992373943328857
决战吧狼星,0.04983055591583252
韩剧流星 搞笑,0.9938627481460571
妈妈正在用什么手机,0.03160417079925537
阿凡达2发布首支预告,0.7022309303283691
00后心中的偶像是什么样的,0.01065438985824585
王俊凯起诉卡马吉他维权,0.9930445551872253
河马乖乖配合做核酸收获半个西瓜,0.00967341661453247
央视曝光骗婚陷阱,0.9941949248313904
广州多区5月7日开展全员核酸检测,0.02107030153274536
微信支持手机温度监控,0.00857764482498169
劳动课将成为独立课程,0.013798177242279053
无锡5月6日新增67例本土无症状,0.48556041717529297
韦东奕,0.008685171604156494
被广州夹缝中的笑脸治愈到了,0.011066794395446777
13岁单亲女孩误服农药或面临截肢,0.9941222071647644
警方回应用胶带绑缚精神病人,0.9941206574440002
男子火车站突然倒地医学博士飞奔救人,0.9899941086769104
庄文杰的爸爸在海南,0.009099721908569336
异物志,0.9941694736480713
钢腿女孩获四川青年五四奖章,0.008732974529266357
禁止以打赏额度对用户进行排名,0.9281945824623108
被母亲节的礼物整破防了,0.9669626355171204
饲养员上班迟到的后果,0.9941725134849548
千万不要吹空调盖被子,0.9924519658088684
女子出租屋垃圾成堆蟑螂爬满墙,0.9941938519477844
男子酒后剐蹭遭巨额索赔竟是好友设局,0.9939047694206238
湖南卫视多档综艺宣布本周暂停播出,0.9931482672691345
有个会拍照的姐妹是什么体验,0.009750306606292725
谁能拒绝挤成一团的滚滚呢,0.017343759536743164
男子回应带8旬患病父亲打工6年,0.9937054514884949
祝融号准备在火星越冬,0.012990772724151611
比亚迪工厂污染疑致多名儿童流鼻血,0.9941905736923218
社区为学生设置专用检测时段,0.012277364730834961
魏晨说是来爸爸当家扮演弹幕角色的,0.014385521411895752
江苏新增70例本土无症状,0.2932504415512085
我为狼队举大旗,0.9923831820487976
反转人生,0.009014248847961426
EXOOverdose发行8周年,0.010226905345916748
真情侣的双人舞太好嗑了,0.009328365325927734
王林清受贿非法获取国家秘密案一审宣判,0.9933634996414185
总得去桂林坐一次竹筏漂流吧,0.008685410022735596
状态不好不要着急去改变,0.9940654039382935
自带烟嗓的小老虎有多可爱,0.009360194206237793
43岁大姐爬泰山直播日出200次,0.038353800773620605
摩登家庭,0.012043416500091553
当妈偷懒就应该被指责吗,0.9941832423210144
侬好我的东北女友,0.008518815040588379
当小奶猫和小奶狗初次见面,0.010814785957336426
拜登宣布对乌克兰新一轮安全援助计划,0.009042501449584961
街道为小吃店开围挡铁窗助力复工,0.027920126914978027
湖南卫视所有综艺都将停播一周,0.994146466255188
改善体态缓解痛经的方法,0.00886237621307373
妈妈最珍贵的照片,0.010947644710540771
阴阳师,0.00995779037475586
看反转人生赶走不开心,0.9940947890281677
你敢向妈妈说我爱你吗,0.010625779628753662
医生建议吃小龙虾1个人不要超过1斤,0.019705891609191895
全网帮庄文杰找爸爸,0.00860297679901123
16岁女孩用零食代替三餐确诊胃癌,0.9940290451049805
三年来1262名民警辅警因公牺牲,0.9941650032997131
四部门发文规范网络直播打赏,0.009644031524658203
女性该如何预防乳腺癌宫颈癌,0.993489146232605
妈妈正在用什么手机,0.03160417079925537
来京老党员投身抗疫一线,0.9940165281295776
两女孩酒店退房留满屋垃圾已长蛆,0.994193971157074
白宇回应角色一个比一个惨,0.994183361530304
强制员工五一加班的董事长辞职,0.9941655397415161
超市放本草纲目小哥忍不住当场尬舞,0.9498034715652466
LOL手游艾克,0.008937239646911621
辽宁教资,0.008629798889160156
四川一小区惊现水中杀手鳄雀鳝,0.9897986650466919
长沙医学院学生给逝者送去鲜花,0.963478147983551
为什么性教育这么难,0.9941627383232117
被妈妈的话破防了,0.9940434098243713
小鬼新专辑先行曲倒计时开启,0.010175526142120361
独行侠1比2太阳,0.011029839515686035
葱油烧麦做法,0.010042011737823486
be美学的暗恋真的好戳,0.008466541767120361
爸爸当家,0.009155571460723877
庄文杰要被绑架四天,0.9939139485359192
夏天的新疆到底有多美,0.008690237998962402
保罗失误,0.9941974878311157
我国拍到马来穿山甲野外活动影像,0.01260918378829956
人民日报论奋斗者正青春,0.012959539890289307
印度强烈反对世卫发布新冠死亡人数,0.9939507246017456
山东专升本,0.008589386940002441
敖子逸黄灿灿新剧定档,0.008841454982757568
杨幂GLASS五月刊封面,0.010056376457214355
这狗的嗓子被鸭子吻过,0.9880017638206482
被4岁萌娃的厨艺拿捏了,0.009329438209533691
T1全员开通微博,0.009231269359588623
向往的生活暂停播出,0.009736776351928711
重生之门灯塔热度连续十日破百万,0.009458839893341064
150碗熟肉案买家用假地址被起诉,0.9941960573196411
9岁女孩打性抑制针半年花十万,0.9918264150619507
刘敏涛女士的法则首唱OST,0.01687932014465332
上海新增本土确诊253例无症状3961例,0.9755756258964539
男子失足坠江多日被民警救起,0.9936268329620361
新娘坐婚房老奶奶集体趴窗围观,0.9919382929801941
切尔西出售所得25亿英镑将全部捐赠,0.009772181510925293
河南新增69例本土无症状,0.9857262372970581
封控小区一天协调8位特殊患者顺利就医,0.01443791389465332
计算机二级,0.008979737758636475
美发现109例儿童不明原因肝炎病例,0.9941044449806213
老友记演员迈克哈格蒂去世,0.019289076328277588
侬好我的东北女友,0.008518815040588379
爸爸当家,0.009155571460723877
谷爱凌度假开摩托艇,0.009772181510925293
妈妈能有多少种身份,0.28018611669540405
切尔西宣布新老板,0.009484291076660156
跳刘畊宏半个月的效果,0.009105682373046875
北京5月6日新增45例本土确诊,0.009966552257537842
老友记,0.008731722831726074
联合国秘书长就乌克兰局势发表声明,0.010470688343048096
重生之门 反派,0.010128676891326904
23年前不能忘的历史画面,0.010814428329467773
太阳vs独行侠,0.9929797053337097
用毒蛇的毒毒毒蛇到底会怎样,0.9938983917236328
天舟四号船箭组合体垂直转运至发射区,0.008803844451904297
上海新增本土死亡病例13例,0.991680920124054
6岁男童失踪14天小区地下室发现身亡,0.9941791296005249
当小狗认错了主人,0.01711946725845337
李玟为关晓彤模仿didadi打call,0.9940127730369568
哈登,0.00836491584777832
川藏南线318自驾攻略,0.009734094142913818
上海中考延期,0.9812067151069641
李俊昊百想视帝,0.012924730777740479
高校大学生体育课组团划船,0.00917285680770874
76人1比2热火,0.009136795997619629
男子300万买全新进口宾利竟是维修车,0.00952756404876709
我驻南联盟大使馆被炸23周年,0.9826881289482117
向往的生活暂停播出,0.009736776351928711
为什么性教育这么难,0.9941627383232117
缅怀在北约轰炸中牺牲的3名烈士,0.019871532917022705
63岁患胃癌老伯跳河救起落水女孩,0.9941873550415039
辽宁新增98例本土无症状,0.9869740009307861
重生之门 断更四天,0.010673046112060547
秋季学期开始劳动课将这么上,0.01487886905670166
北京要求结婚登记需持48小时核酸阴性证明,0.226920485496521
侮辱西外女生脱口秀演员发视频道歉,0.9938333034515381
北大数学院院长谈韦神,0.009827613830566406
韦神,0.009915471076965332
关晓彤梦想是成为王牌对王牌最幽默的人,0.009605586528778076
金泰梨百想视后,0.008962154388427734
适当喝咖啡能预防帕金森病,0.013581335544586182
10男子冒充美女2个月加5万好友,0.9938749670982361
古巴哈瓦那一酒店发生爆炸事故,0.9941391944885254
宁檬陆既明吻后社死现场,0.9939473867416382
F1,0.008530795574188232
谢可寅首部电影成为赢家,0.00882631540298462
女生铁路淡定拍照火车就在身后,0.9937496185302734
想大口喝矿泉水女孩的双腿保住了,0.012219667434692383
聂树斌案推动者郑成月离世,0.9936224818229675
我也不明白为啥要去露营,0.991874635219574
济南新增本土无症状3例,0.34245765209198
营口新增69例本土无症状,0.9753915071487427
大爷听信药贩种33株罂粟被罚,0.9938785433769226
缅怀邵云环许杏虎朱颖,0.009739816188812256
高考倒计时1个月,0.014524579048156738
日本在台湾问题上对中国人民负有历史罪责,0.9941283464431763
缅怀在北约轰炸中牺牲的3名烈士,0.019871532917022705
北京昨日筛出5管混采阳性,0.9928337335586548
哈佛曾为韦神打破校规,0.0097733736038208
iPhone14参数,0.008869051933288574
女子动物园隔玻璃打狒狒引其暴怒撞头,0.9941884279251099
警方回应山东一美食博主疑似轻生,0.9941378831863403
浙江105岁奶奶喝了100年咖啡,0.0121612548828125
长春辟谣,0.9941237568855286
贾乃亮在王牌对王牌立的flag全倒了,0.9939349293708801
女子奶茶里喝出7厘米出粉机零部件,0.9941155910491943
5月6日苏州疫情防控新闻发布会,0.08164137601852417
外交部批美官员渲染中国核威胁论,0.9939752221107483
按揉1个穴位帮你快速入眠,0.9933568835258484
辽宁舰上一群95后用英语对外军喊话,0.01945394277572632
周深米卡合作Cityofstars舞台,0.009058177471160889
陆既明讨人厌的原因找到了,0.9941064119338989
汕尾一诈骗团伙冒充白富美骗外国人,0.9941806197166443
小个子女生有多少困扰,0.9931061863899231
苹果iPhone14没有mini,0.011610150337219238
纳达尔,0.00834500789642334
脱口秀演员表演时疑侮辱高校女生,0.9941967725753784
天赐的声音,0.008596837520599365
周深米卡合作Cityofstars舞台,0.009058177471160889
流星雨,0.9941245913505554
中青宝董事长辞职,0.9743676781654358
vox直播,0.011018097400665283
如何看待手机使用上代芯片,0.9937230944633484
第一次感觉能听懂鸟语,0.009030401706695557
祝融号准备在火星过冬,0.6823345422744751
被主人气到皱眉的金毛,0.9941657781600952
减肥也不能委屈嘴,0.009279012680053711
柳州除了螺蛳粉还能吃什么,0.00950467586517334
韩剧流星,0.9941957592964172
海外微信,0.008923888206481934
赵磊戴燕妮你好不好舞台合作,0.013827621936798096
天赐的声音,0.008596837520599365
动手能力强得像是有魔法,0.008720576763153076
流星雨,0.9941245913505554
减肥也不能委屈嘴,0.009279012680053711
李易峰工作室回应被起诉,0.9939361214637756
坏掉的水果都去哪了,0.994152843952179
王牌对王牌张晚意演技爆发力,0.012948751449584961
原来小女孩也爱生气,0.994170069694519
