keywords,score
生逢伟大时代是人生之幸,0.00946033000946045
什么是猴痘,0.993536114692688
厦门航空回应网传90后飞行员跳楼,0.9941667318344116
各地高考防疫政策汇总,0.011851370334625244
专家不建议年轻人掏空六个钱包凑首付,0.9925360679626465
长沙市民起诉LV专柜售假获三倍赔偿并退货,0.9856511950492859
建议专家不要建议,0.019760191440582275
胡一天好帅,0.008532047271728516
宋亚轩被吴彤传染成了宋呀轩,0.012919485569000244
余生请多指教520很甜,0.008591115474700928
长沙警方通报男童被公交撞倒身亡,0.9938884377479553
黑帮少爷爱上我,0.010130584239959717
刘畊宏的520礼物是钻戒,0.009857535362243652
三个少年,0.17507070302963257
北京未参加核酸筛查病例感到后悔,0.9941332936286926
俄方在亚速钢铁厂内发现乌军遗留的孙子兵法,0.009938597679138184
出现在16楼窗外的狗,0.9128227233886719
15岁少年沉迷游戏直播打赏主播80万,0.9940155744552612
哈利波特,0.008829951286315918
心梗前身体向你发出的3个求救信号,0.9941190481185913
小肚腩算是碰到克星了,0.9923156499862671
宇宙少女舞台,0.011778652667999268
余生请多指教二轮上星,0.008539915084838867
萧北辰一集叫了林杭景六遍嫂子,0.009396731853485107
epic,0.008639276027679443
司机回应从山体滑坡中拔出4名学生,0.9940494298934937
原神2.7版本,0.008728623390197754
为给孩子喂一口饭妈妈等了18年,0.9922854900360107
原来狗狗也喜欢惊喜,0.008573055267333984
吴尊友解读为何不断从社会层面查出感染者,0.014446914196014404
学生要高考老师竟漏报名,0.994021475315094
传家,0.008687794208526611
张杰为谢娜新综艺乘风破浪打call,0.9932409524917603
韩庚说我真的栓Q了,0.01074516773223877
Queendom2,0.00961834192276001
中国三名裁判入选卡塔尔世界杯裁判名单,0.009250819683074951
水晶哥预测MSI对抗赛,0.00914674997329712
广西抓捕毒贩现场,0.992202639579773
医院回应男子体检报告单查出子宫,0.9939597845077515
北京昨日检测出1管十混一阳性,0.9941476583480835
年轻人能有多懒,0.9941297769546509
吴谨言是秦岚向日葵吧,0.009193599224090576
朱七七沈浪世纪合体,0.008825838565826416
重生之门,0.008640110492706299
小米一季度净利润同比下降52.9%,0.9902687072753906
人生第二次寻子母亲群像好催泪,0.9941919445991516
茅台冰激凌39元一份,0.0102003812789917
来自生活的小惊喜有多治愈,0.00882643461227417
夜宵就是要吃螺蛳粉,0.013453125953674316
爱尔眼科广告配文称近视有罪,0.9940547347068787
别人的3岁vs我的3岁,0.010245025157928467
刘畊宏直播,0.008746325969696045
HYBE再为金佳蓝发声,0.00960993766784668
许正清 手表,0.008519172668457031
志愿者画插画致敬抗疫工作者,0.009761214256286621
张歆艺说520单身的跟我看乘风破浪,0.021184325218200684
花椰菜,0.9798974394798279
张大仙说XYG的瓜不好吃,0.994145393371582
女子举报就诊被医生诱骗保持不当关系,0.9941909909248352
写没头脑和不高兴的爷爷100岁了,0.9941064119338989
女孩骑摩托车帮消防车开路,0.01134037971496582
4AM吃鸡,0.008676886558532715
庄文杰溺水,0.9834311604499817
电视剧欢迎光临,0.008878588676452637
新白娘子传奇开播三十周年,0.010571062564849854
洛阳博物馆里的马很绿,0.013079047203063965
张靓颖微博直播,0.008439481258392334
年轻人为了偷懒有多拼,0.993411123752594
闪亮的日子第二番嘉宾阵容,0.008519530296325684
美的集团回应裁员,0.9914942979812622
熊猫荡秋千翻车现场,0.027621865272521973
专家称买房比租房划算,0.009134113788604736
北方早餐有多硬核,0.04693883657455444
庄文杰听我说谢谢你,0.008471131324768066
小米发布2022一季度财报,0.009811699390411377
废墟上的寻子之家终于铺上了红地毯,0.9940037131309509
倡导简约适度绿色低碳的生活方式,0.009611546993255615
管控区出生4天婴儿需就医三分钟送达,0.013972878456115723
金佳蓝校暴受害者发声,0.9941835999488831
重庆10元打工人盒饭,0.013328135013580322
双芯会成为行业标配吗,0.009537041187286377
夜宵就是要吃螺蛳粉,0.013453125953674316
vivo发布会,0.008499622344970703
小布什谈俄乌冲突口误说成伊拉克,0.9922072291374207
多地拟将试管婴儿费用纳入医保,0.9835873246192932
萧敬腾 四川,0.9924851059913635
许正清果然是先生,0.008471965789794922
大乔挚爱花嫁技能特效优化,0.009004414081573486
突然觉得李易峰配不上自己,0.993159294128418
北京坚定不移推进社会面动态清零行动,0.010631978511810303
浙江拟提高0至6岁婴幼儿医保报销比例,0.012775182723999023
四川一司机从泥中拔出4名学生,0.023269057273864746
那些听一遍就爱上的音乐现场,0.009013593196868896
杨迪一起露营吧看羌族小煞名场面,0.9869120121002197
北京社会面筛查2例感染者,0.014516830444335938
超九成毕业生免押金后仍按时交房租,0.021002352237701416
没人能拒绝这样的毕业设计,0.012489676475524902
萌探探探案,0.0256081223487854
大妈替儿子表白女车长遗憾被拒,0.9938474297523499
42年前东风五号发射现场珍贵画面,0.008932173252105713
热心大哥免费为滞留旅客送饭,0.03035658597946167
Scout的招牌佐伊,0.0115584135055542
小鹏汽车被曝毁约20余名应届生,0.9939716458320618
国宝幼崽这一跤也摔太远了,0.9940816760063171
洛阳早半年买房月供竟多出1200元,0.012567877769470215
丈夫隐瞒乙肝病史妻子起诉要赔偿被驳,0.9941028952598572
国货雪糕越来越健康,0.008907496929168701
杭州地铁1号线全线恢复通车,0.008461952209472656
哪吒之魔童闹海立项,0.9939291477203369
北京市新增本土感染者64例,0.9925634264945984
香蕉娱乐推出首个嘻哈女团,0.009590506553649902
女生主动的爱情能有多甜,0.009644269943237305
腾讯回应没有获得首批游戏版号,0.795005202293396
3岁萌娃练书法半年能写上百字,0.009027242660522461
重庆一小区天降菜刀险伤人,0.9941840767860413
外交部回应美方倡议台湾参加世卫大会,0.05368363857269287
两个人的小森林官博回应,0.2779881954193115
1根跳绳就能高效燃脂,0.008538961410522461
100种实用表白技巧,0.008545756340026855
北京理工大学房山分校发生疫情,0.9937393665313721
俄在乌发现可喷洒药剂的无人机,0.021503686904907227
殷桃新剧女人万岁海报,0.01665353775024414
福星小子新作动画,0.01510542631149292
女生校园摆摊肩颈按摩4元一次,0.01577472686767578
WB全员许愿整活,0.011239111423492432
长月烬明,0.010648667812347412
河南村镇银行取款难背后,0.9940279722213745
二十四味董思怡演的夏语冰是古代搞笑女吧,0.009817779064178467
成都火锅巴士即将上线,0.008730769157409668
几个小巧思让你有效送礼,0.008803367614746094
papi酱说不要对职场妈妈过度照顾,0.011282563209533691
北京疫情防控第339场新闻发布会,0.0357246994972229
你愿意花时间教老年人用手机吗,0.9939435124397278
北京理工大学房山分校升为中风险,0.9922777414321899
乘风破浪乘风发布人谢娜,0.9939379692077637
学生拍毕业照遇洒水车喷出一道彩虹,0.016471505165100098
且试天下官博,0.008665025234222412
专家称今年6到10月是购房好时机,0.009411931037902832
久酷,0.008606374263763428
88岁奶奶每天对监控给孙女开吃播,0.015846073627471924
哪吒续集备案,0.9937897324562073
马斯克称中国经济规模将达美国两三倍,0.00864255428314209
北京房山新增25例本土感染者,0.014840185642242432
异地恋里的分寸感有多重要,0.017178118228912354
粉丝不满经纪公司偷改艺人航班,0.9942003488540649
王刚的刀功教学,0.00864863395690918
老年人感染奥密克戎病死率是普通流感近百倍,0.9940922856330872
老师背着黑板去给83名残疾学生上课,0.9941404461860657
安乐传,0.008365392684936523
小朋友深夜拨打119求充话费,0.9937970638275146
与病毒昼夜赛跑的疾控人,0.9941790103912354
成人和小孩海姆立克急救法做法不同,0.012600421905517578
小伙为起床定多个闹钟导致情绪焦虑,0.9941232800483704
北京疫情防控第339场新闻发布会,0.0357246994972229
孙怡萌探2孙尚香造型,0.008682966232299805
徐梦桃王心迪套圈式爱情,0.012114405632019043
儿子卡喉幸好爸爸会海姆立克法,0.009465813636779785
且试天下,0.008682608604431152
孩子捡到20元带字纸币报警解救11人,0.011181771755218506
新疆喀纳斯湖再现不明生物,0.99418044090271
都是辉夜大小姐惹的祸,0.9941205382347107
你有起床拖延症吗,0.9939751029014587
谁能抵挡立麦的魅力,0.009792983531951904
市监局回应顾客在海底捞吃河豚中毒,0.994118332862854
余霜说为LPL发声是本职和本心,0.01040184497833252
不能露脸的缉毒英雄,0.014983773231506348
美国在台湾问题上实际行动与表态大相径庭,0.9942017197608948
徐梦桃首支单曲我是第一预告,0.00877833366394043
你心中爱的味道是什么,0.008819162845611572
一个博物院就是一所大学校,0.008441925048828125
陈赫退出福建贤合庄股东,0.9931558966636658
萌探探探案,0.0256081223487854
Uzi直播预告,0.09585326910018921
四六级,0.008579373359680176
刘耀文萌探2高马尾造型路透,0.008989930152893066
苹果武汉直营店5月21日开业,0.008829176425933838
男子被毒蛇咬伤两地交警接力送医,0.9938439130783081
彭佳慧确诊新冠,0.008628129959106445
上海拟从5月22日起逐步恢复跨区公共交通,0.00903850793838501
真实的缉毒现场有多惊心动魄,0.012260138988494873
白鹿宁安如梦开机,0.008951723575592041
你多久换一次电脑,0.009463489055633545
哆啦A梦剧场版首发中文预告,0.010845959186553955
陈伟霆录一起露营吧没化妆,0.9940218329429626
机械动力学家黄文虎院士逝世,0.9670358896255493
洛阳市民打卡520爱心斑马线引质疑,0.9939882755279541
消极比赛被封号玩家起诉腾讯辩称打得菜败诉,0.994200587272644
乌克兰决定延长国家战时状态90天,0.060268938541412354
这才是溢出屏幕的尴尬吧,0.9941925406455994
博物馆文物出现在生活里会怎样,0.008948922157287598
多一颗芯对拍照有啥影响,0.010290920734405518
安乐传,0.008365392684936523
宁安如梦,0.008849501609802246
重生之门 洛神的秘密,0.01071786880493164
女大学生回乡教种地带动全村致富,0.011059701442718506
疫情下爱的自拍,0.010587751865386963
为什么李白的诗能穿越时间,0.01040637493133545
妇炎洁广告为何令人反感,0.9942010045051575
这位婚礼摄影是气氛担当吧,0.00937730073928833
考古现场让人泪目的瞬间,0.9940199851989746
科学家开发出夜间太阳能,0.009460926055908203
谢谢每个平凡的守沪者,0.009177207946777344
郑大女生私自外出感染新冠被立案,0.9941112399101257
蔡健雅新冠确诊,0.008450984954833984
优酷宠爱剧场520片单,0.008701026439666748
Uzi直播预告,0.09585326910018921
冰箱冷柜收纳你做对了吗,0.010344862937927246
你相册里第一张照片的故事,0.009534239768981934
刘宇宁原声台词,0.008949637413024902
月洋,0.008438646793365479
当你发现姥姥坠入爱河,0.012045025825500488
TaylorSwift被纽约大学授予荣誉博士学位,0.008582353591918945
金赛纶道歉,0.008365631103515625
王子奇苏晓彤二搭新剧官宣,0.00902092456817627
才知道答辩也要会道歉,0.00894695520401001
男子诈骗190万在网上赌博被骗光,0.9941938519477844
取快递被锁是种什么体验,0.9941169023513794
乘风破浪,0.9941452741622925
妈的多重宇宙,0.9940396547317505
学习通崩了,0.9941072463989258
库里21分12篮板,0.008868515491485596
一网民侵害袁隆平名誉被判公开赔礼道歉,0.9938755631446838
维金斯19分,0.008726418018341064
上海新增82例本土确诊637例本土无症状,0.02351754903793335
黄山休宁县急需物资捐赠,0.42633408308029175
金色血统,0.011188030242919922
北京90后手语师核酸现场为听障人士翻译,0.9928007125854492
库里连续三分鬼步舞庆祝,0.01005089282989502
勇士1比0独行侠,0.009531795978546143
i茅台即将上线飞天茅台,0.009110629558563232
妈的多重宇宙,0.9940396547317505
奔跑吧预告,0.01022350788116455
安乐传一眼倾慕海报,0.013255298137664795
白敬亭有求必应小剧场,0.008701682090759277
河南5月18日新增本土确诊11例无症状9例,0.013225197792053223
喜欢你3两支玫瑰花语是坚定且唯一,0.009207308292388916
高校宝藏公开课,0.00859004259109497
瘫痪消防员组建残障电竞队,0.9941827654838562
拜登女儿新冠检测阳性,0.018034636974334717
上海武康路警戒线拆除居民打卡,0.9204889535903931
河南四六级,0.008862614631652832
二进制恋爱定档,0.009224236011505127
上海英语四六级考试延期,0.26987844705581665
由两封信开启的忘年之交,0.018650472164154053
独行侠vs勇士,0.01072239875793457
遇见你定档七夕,0.008816123008728027
李汶翰新片预告分手真实感,0.009194731712341309
美国确诊本年度首例猴痘病例,0.03747296333312988
长沙小学生放学过马路被公交车撞倒身亡,0.9940997362136841
护心,0.008382737636566162
东契奇脸被抓出血痕,0.994090735912323
如何选择一款合适的冰箱冷柜,0.008963584899902344
河北两村庄因建光伏电站毁百亩麦地,0.9936830997467041
北京新增确诊病例详情,0.00999385118484497
瞬息全宇宙,0.9938952326774597
刘涛王珂起诉造谣者,0.9940912127494812
这才是适合卫生巾的slogan,0.008713781833648682
送控糖女友甜筒花,0.014431536197662354
冰箱冷柜应该如何收纳,0.009846746921539307
林娜琏将6月24日solo出道,0.009525716304779053
打卡体验西虹市首富的快乐,0.009048819541931152
中国妇女报评妇炎洁低俗广告,0.994144856929779
天津新冠阳性考生在医院参加春季高考,0.01338130235671997
彭于晏被四川丈母娘集体嫌弃,0.994178295135498
北京昨日新增本土确诊50例,0.01050257682800293
男生2.03秒复原金字塔魔方破亚洲纪录,0.008741557598114014
班主任把封闭住校高三学生宠上天,0.9939332604408264
四川新增本土确诊34例,0.009188652038574219
蜂花,0.00946265459060669
上海外滩为援沪医疗队开放,0.008430123329162598
美股,0.00837773084640503
俞敏洪称很多年轻人没有退身之所,0.021557211875915527
蜂花回应再次走红,0.9940797090530396
猴子突然失去了快乐,0.993920087814331
5月18日新增本土确诊191例,0.010826587677001953
初婚平均年龄普遍推迟,0.9938437938690186
土耳其阻止芬兰瑞典加入北约的谈判,0.992254376411438
400斤重宠物猪帮主人驮菜,0.010442078113555908
大宋少年志2原班人马回归,0.010388970375061035
美国足协与男女足达成同工同酬协议,0.009113073348999023
四川新增本土无症状115例,0.01466745138168335
5月18日新增本土无症状825例,0.04148334264755249
原来跳绳可以这么好看,0.008511543273925781
高校追回多名已毕业研究生国家助学金,0.06157064437866211
5月18日新增确诊212例,0.009685814380645752
90后父母用宝宝哭声哄娃,0.991463840007782
被一只小狗给治愈了,0.010614275932312012
广安新增本土确诊33例无症状112例,0.953667402267456
陈妍希跳刘畊宏女神操,0.008853137493133545
林妙妙钱三一牵手了,0.00843667984008789
蜂花主播说没见过这么大场面,0.012344419956207275
女团jessica回来了,0.03008294105529785
44岁牺牲交警生前最后一刻画面,0.9937630295753479
外卖被拿走的饿了么订单当事人回应,0.9938862919807434
NBA季后赛,0.008375346660614014
量紫俪学,0.008569180965423584
959人走出亚速钢铁厂投降,0.9939785003662109
读懂百年大党的青春密码,0.010091543197631836
胡锡进,0.008582651615142822
许正清是不是先生,0.008517265319824219
天津春季高考6月12日举行,0.008400797843933105
以投资墓地为由百余名老人被骗超650万元,0.9941993951797485
文泰一确诊新冠,0.008739173412322998
澳门酒店双女尸案告破嫌疑人落网,0.994175374507904
婴儿被兔子咬断手指交警4分钟送医,0.057576894760131836
明日零时起北京公交启动乘车码升级服务,0.008685052394866943
腾讯起诉vivo不正当竞争,0.9941841959953308
官方通报杭州金沙湖地铁站进水,0.9941008687019348
杨紫成毅沉香如屑即将上线,0.009014248847961426
那些演戏反差感很大的演员,0.9940494298934937
市监局将立案调查妇炎洁问题广告,0.9941431879997253
俄罗斯饮料制造商推出本土版可乐,0.3909687399864197
那些影视存货满满的演员,0.9918999671936035
315曝光土坑酸菜厂被罚55万,0.9941667318344116
河南村镇银行取款难储户发声,0.9938260912895203
小象莫莉在妈妈陪伴下隔离观察,0.028205156326293945
520男生最想收到的礼物,0.00871741771697998
香港金像奖海报,0.008813321590423584
沉迷于搞反华小圈子没有出路,0.992095947265625
上海6人哄抬物价被采取刑事强制措施,0.9941714406013489
黄轩新剧是床宝男吧,0.010053098201751709
林更新演技,0.008499860763549805
肌肉酸痛就来拉伸吧,0.993811309337616
重生之门,0.008640110492706299
阿德巴约一级恶意犯规,0.9941962957382202
2022优酷大剧片单,0.008681237697601318
被云南的零食馋哭了,0.02592402696609497
庄文杰西装,0.008469104766845703
郑秀妍张天爱吴谨言女团舞,0.008439362049102783
一见钟情的正确打开方式,0.008541643619537354
乘风破浪启航曲MV,0.010770738124847412
杭州地铁1号线金沙湖站暂时不停,0.010698258876800537
一发言就紧张要怎么办,0.9941233992576599
告五人新歌我以为你不会出现,0.010373950004577637
77岁奶奶轻松完成20多个引体向上,0.03441661596298218
这居然是黄奕,0.012718617916107178
找赵继伟要喜糖,0.009550750255584717
许正清是不是先生,0.008517265319824219
天津新增19名阳性感染者,0.9934752583503723
中国人1000多年前就把跳水玩出了花,0.009163856506347656
中餐厅6将回归大自然,0.009116828441619873
