keywords,score
时代造就青年盛世成就青年,0.008696794509887695
人民日报连麦刘畊宏,0.009238660335540771
山东蓝翔校长女儿再发声,0.009365260601043701
966人荣获2022年全国五一劳动奖章,0.009214162826538086
泡泡玛特,0.009009122848510742
重生之门 刺激,0.008379697799682617
北京朝阳医院发现一初筛阳性人员,0.9872303605079651
天津市长廖国勋突发疾病去世,0.9938230514526367
庄文杰被电击抽氧,0.010323584079742432
美国今年一季度GDP下降1.4%,0.992840051651001
热播剧男主开始卷智商了,0.01513826847076416
央八,0.0087432861328125
山东男子1.1亿存银行竟全消失,0.9938943982124329
有一个喜欢的人有多重要,0.00876927375793457
天盛长歌,0.008514463901519775
男子花数十万元摆花海求婚,0.01296001672744751
你最喜欢的动画是哪一部,0.008623123168945312
凰权,0.011980116367340088
北京健康宝遭受境外网络攻击,0.9941279888153076
人民日报限定款阳光宅男版健身操,0.010780036449432373
清融,0.008354723453521729
风起陇西,0.00870591402053833
重生之门,0.008640110492706299
eStar战胜狼队,0.010168194770812988
全浙江都在跳刘畊宏健身操,0.009528279304504395
妻子举报丈夫勾结国企高管骗国家资金,0.9941279888153076
封控区孕妇疑先兆流产朝阳民警十分钟送医,0.9941108822822571
西安摘星,0.0101814866065979
宋亚轩说今晚三个少年用冷笑话幽你一默,0.009388267993927002
广州疫情,0.9930410385131836
在人民日报直播间跳操是啥体验,0.010210573673248291
天下归元,0.015588760375976562
KPL,0.008742928504943848
三个少年,0.17507070302963257
让男朋友叫姐姐是什么体验,0.010487377643585205
蒜香黄油虾有多好吃,0.008722543716430664
华为手环7,0.00878077745437622
西安全域均为低风险地区,0.9938884377479553
俄罗斯宣布驱逐8名日本外交官,0.012494564056396484
爱原来是要见面才能维持,0.009746134281158447
被人真心的喜欢是什么体验,0.009332835674285889
珀莱雅,0.008356928825378418
美少女战士剧场版特报,0.010340988636016846
同济大学回应学生盒饭吃出虫卵异物,0.9941668510437012
演唱会大合唱名场面,0.008511662483215332
BIGBANG新歌6个一位,0.00868004560470581
酷云,0.008469343185424805
北京疫情,0.04491513967514038
华为matexs2价格,0.009037673473358154
臭豆腐螺蛳粉火锅有多绝,0.008898377418518066
印花税,0.012577176094055176
庄文杰被电击抽氧,0.010323584079742432
广州疫情,0.9930410385131836
智能手表颜值哪家强,0.008450031280517578
减脂也能吃的冰淇淋,0.009466290473937988
重生之门转场,0.00868004560470581
官方通报幼儿园被曝用过期奶发臭肉,0.9941904544830322
EDG冠军幕后故事预告片,0.011803686618804932
家长怒斥幼儿园给孩子吃过期食品遭怼,0.9942014813423157
德宏州全面实现动态清零,0.008508026599884033
主人掉水里狗狗的反应,0.9935804605484009
女子回家发现妈妈用桑葚染发,0.019116461277008057
新疆民警暴雨后在泥里拔羊,0.9938941597938538
美方要求台当局花80亿美元买波音飞机,0.01377648115158081
华为发布会,0.00917816162109375
余承东称中国新标准必走向世界,0.009033441543579102
谭卓拍戏断肋骨,0.9940577745437622
华为手机支持3D精准室内定位,0.009054303169250488
坦然夏侯惇好肉,0.008514463901519775
苏翊鸣的开挂人生,0.688889741897583
思政课的本质是讲道理,0.008604109287261963
北京流动医疗车开进管控区,0.07681745290756226
重生之门大结局拍了好几个版本,0.008828461170196533
eStar对战狼队,0.9786059260368347
印花税,0.012577176094055176
华为手表支持动脉硬化风险筛查,0.010954082012176514
总在毕业季怀念起学生时代,0.009106159210205078
暗恋期穿搭有多甜,0.01004117727279663
中巴有决心有能力斩断恐怖分子的黑手,0.06514894962310791
华为折叠屏首创自适应UI引擎,0.009573400020599365
这舞跳到了我的心巴上,0.008585870265960693
微博全量开放IP属地功能,0.09149789810180664
知名经纪人拉伊奥拉因病去世,0.991292417049408
莎头,0.008656740188598633
巅峰使命珠峰科考活动全面启动,0.009509444236755371
村书记挨家挨户帮被隔离村民喂畜禽,0.02335524559020996
北京朝阳二轮核酸初筛7管阳性,0.010819613933563232
一口一个的草莓纸杯蛋糕,0.008405625820159912
北京新增本土感染者56例,0.9864810705184937
股票交易过户费总体下调50%,0.2471141815185547
太原摘星,0.016049861907958984
燕破岳们代表了新一代特战队员,0.009008049964904785
2022想看人数破10万的待映新片,0.008947908878326416
北京海洋馆有条豹里豹气的中华鲟,0.009488999843597412
任何人不看重生之门我会伤心的OK,0.9937747716903687
西昌蓝花楹花海,0.008367836475372314
保时捷发布会直播遭车主维权,0.9941148161888123
重生之门制片人谈选王俊凯出演的原因,0.01056605577468872
广州新增4例本土阳性感染者,0.9812218546867371
女生不喜欢一个人时的表现,0.9936308264732361
如何评价华为发布新款折叠屏,0.010041773319244385
蒜蓉烤茄子有多香,0.008459270000457764
如果没有疫情五一你在干嘛,0.991275429725647
和赵继伟一起热聊总冠军,0.009675025939941406
北京朝阳劲松五区临时管控中的日常,0.010204493999481201
10元敲馄饨有多难买,0.9941908717155457
女子连跳3天毽子操后黄体破裂,0.9941046833992004
大葱爆鸡胸肉,0.9933696985244751
华为发布会,0.00917816162109375
北京通报两起规模较大聚集性疫情,0.011531054973602295
湄公河惨案主犯糯康临刑前独白首公开,0.9936375617980957
珀莱雅,0.008356928825378418
北京朝阳新增14例本土感染者,0.013017714023590088
谭松韵演唱请叫我总监爱情主题曲,0.008615255355834961
花儿与少年拟邀嘉宾阵容,0.010278046131134033
夫妻吵架什么话不能说,0.9940983057022095
EDG冠军海报,0.008898496627807617
杭州可查询核酸检测点拥堵情况,0.9941556453704834
周笔畅翻唱陈奕迅的歌,0.008650779724121094
上海累计报告6岁以下儿童阳性感染者12707例,0.14405983686447144
这火锅吃的有点严谨,0.008655905723571777
当代大学生都有什么烦恼,0.9934200644493103
被千层香酥牛肉饼香迷糊了,0.025698423385620117
员工因父亲患癌申请爱心基金反被裁,0.993647038936615
长沙天气,0.009995996952056885
国防部称绝不姑息分裂图谋,0.014266252517700195
当男生第一次体验分娩痛,0.12710005044937134
撒娇文学,0.994126558303833
任何人不看重生之门我会伤心的OK,0.9937747716903687
大白合唱生日歌为封控宝宝庆生,0.02463364601135254
巴奴火锅店长回应内涵海底捞,0.012097954750061035
一起露营吧今日开播,0.9931461811065674
重生之门好像在演我,0.01006317138671875
90后宝妈瞒着家人刷单三天被骗54万,0.9941960573196411
和平精英送毽子操动作,0.008571326732635498
女子2小时饮3升水险丧命住ICU,0.9941967725753784
国家卫健委要求节假日保证急诊24小时开放,0.01569145917892456
学生校内骑车避让小孩摔倒遭家长辱骂,0.9940420985221863
杨幂费加罗男士五月刊封面,0.010102272033691406
河南2022年高考时间安排公布,0.00843113660812378
北京海淀新增3例本土感染者,0.017979800701141357
90后妈妈用玩具鱼哄孩子睡觉,0.9940694570541382
文旅部回应五一假期能否出游,0.010097861289978027
云南瑞丽城区有序复学复课,0.00835341215133667
网友环球影城偶遇马龙,0.3682764172554016
重生之门庄文杰林芷悦牵手,0.008503437042236328
东风快递员展示18式俯卧撑,0.009251058101654053
动画梳理北京疫情传播链,0.9882932901382446
北京囤货太多市民直呼后悔,0.9941938519477844
眼妆算化妆科目几,0.009769976139068604
吉林省高三,0.008419692516326904
幼儿园窜入一条大蛇直奔玩具堆,0.9797670841217041
一听就心动的情歌,0.00889366865158081
近期发生本土疫情的风险仍较高,0.9941237568855286
女子睡眠呼吸暂停致面部双腿浮肿10年,0.9941508173942566
朴珍荣将出演新剧魔女,0.008986175060272217
俄罗斯决定退出联合国世界旅游组织,0.992629885673523
全民健身线上运动会,0.008485078811645508
文旅部提示不要前往中高风险地区旅游,0.9939603805541992
谷爱凌发博说谢谢中国,0.010874032974243164
成都天空出现超大日晕,0.9902730584144592
长沙暴雨,0.022406578063964844
男孩偷倒饭菜妈妈让他捡起干净的吃掉,0.9908419847488403
成都日晕被玩坏了,0.99394291639328
向往的生活明日开播,0.008589386940002441
成年人幼稚行为图鉴,0.9888229370117188
吉林省高三,0.008419692516326904
中国好邻居说不想给别人添麻烦,0.04168546199798584
重生之门庄文杰有感情戏,0.008703231811523438
用600多天较真打磨一部戏,0.008861958980560303
丁程鑫刘耀文张真源录制央视五四晚会,0.008591115474700928
日晕,0.9940614104270935
安琪拉心灵骇客星元,0.9941539168357849
26省份2021年出生人口数据,0.009292840957641602
普京警告用最先进武器闪电般反击外部干预,0.009322285652160645
4月全国有31个省份261个地市报告本土疫情,0.9862828850746155
该不该让孩子吃零食,0.9937870502471924
张若昀在大侦探已经有被整蛊后遗症了,0.9939358830451965
窦骁陈都灵新剧cp感,0.010473251342773438
广州白云机场实行临时管控,0.05726063251495361
颖儿山河月明当了三集皇后就下线了,0.01872473955154419
大伯被蜱虫叮咬感染病毒送进ICU,0.994166374206543
人民日报论谱写新时代的青春之歌,0.00851505994796753
房山大白冒雪为特殊群体做核酸,0.9901376962661743
杨洋且试天下脆弱感,0.02856355905532837
江南百景图,0.008362829685211182
可以剪断128层布的手工剪,0.00973433256149292
七旬老人日扛米糠400袋救癌症复发孙女,0.9912043213844299
只有星期四才有的快乐,0.010025978088378906
男子跳水库救男孩大喊游不动了,0.9939999580383301
袁冰妍回忆第一次拍戏挡镜头被导演凶,0.9935455918312073
猫去的的地方比我都多,0.029201030731201172
陌生奶奶地铁上用手为女孩捂膝保暖,0.9937788844108582
马斯克称接下来要收购可口可乐,0.010507345199584961
小心骗子以健康码异常为由诈骗,0.9941977262496948
上海新增本土确诊1292例无症状9330例,0.04670405387878418
盐水和淀粉哪个洗菜更干净,0.00956714153289795
雪豹怼脸拍好可爱,0.009260892868041992
南京女子购买吸痰管救助上海渐冻症患者,0.02177649736404419
王俊凯庄文杰的九大美德,0.008682012557983398
余生请多指教韩版预告,0.008798360824584961
美加提议将冻结的俄资产转给乌克兰,0.9675974249839783
我国首座考古学科专题博物馆,0.00892341136932373
北京封控区居民病情复发警方闭环送医,0.994149923324585
六至八成欧盟人口或已感染过新冠,0.9917610883712769
争做堪当民族复兴重任的时代新人,0.008825421333312988
福奇称美国已摆脱新冠大流行阶段,0.041561663150787354
社区工作者冒雨坚守核酸现场,0.9938830137252808
51岁女子与情人预谋杀丈夫,0.9939625859260559
当代网友的文采到底有多好,0.00875920057296753
广州白云区28日开展全员核酸,0.012791037559509277
瞬息全宇宙深度解析,0.08719784021377563
NBA,0.008464694023132324
不舍主人出嫁的狗狗,0.33584094047546387
戚薇为大侦探全员准备干饭人盲盒,0.9940464496612549
颜真卿首例考古出土手书墓志公开展出,0.00848013162612915
姚策养母许敏获赔79万元,0.010077893733978271
2022毕业生平均签约月薪6507元,0.00923687219619751
北京率先放开自动驾驶主驾无人许可,0.9885361194610596
河南教资面试可申请退费成绩延期,0.9932177662849426
济南小伙瞒父母一线抗疫12天后被发现,0.9940459728240967
勇士淘汰掘金,0.9940243363380432
已有4名欧洲买家用卢布买俄气,0.01201164722442627
我国10省份人口出现自然负增长,0.9938129186630249
市监局回应幼儿园用过期牛奶发臭肉,0.9941798448562622
错换人生案不存在偷换行为,0.9760448932647705
一起探恋爱24K纯素官宣,0.009112238883972168
乌官员称乌军可于7月开始反攻,0.011891543865203857
被小猫咪的友情整破防了,0.9900026321411133
你永远可以相信库里,0.008624017238616943
重生之门首播热度破9000,0.009390175342559814
上海新增本土无症状降至1万以下,0.9901651740074158
福州马尾发现1例可疑阳性,0.994198203086853
白云机场例行核酸发现异常,0.994191586971283
新郎没做核酸蹲门口看婚礼直播,0.011818766593933105
日本失联观光船公司社长下跪道歉,0.9938638210296631
五一假期前油价迎来调整,0.011166930198669434
05后写诗能有多厉害,0.00883018970489502
油价,0.0097428560256958
王源的骄傲是写给妈妈的歌,0.9941803216934204
四川省考,0.008615374565124512
网剧反转人生,0.011263549327850342
李现悦游六月刊海边封面,0.008480608463287354
健康电竞挑战,0.008411705493927002
扬州疫情,0.99398273229599
北京朝阳新增临时管控区域,0.010411620140075684
五一民航客运量预计下降超7成,0.9626836776733398
广西支援上海的物资有多好吃,0.008566498756408691
我和我的青春,0.008655548095703125
北京昨日新增48例本土确诊,0.010932862758636475
马伯庸,0.00992363691329956
京杭大运河实现全线通水,0.008383333683013916
阿凡达将再次重映,0.008708715438842773
liella,0.9941931366920471
上海一公寓负责人侵吞防疫保障物资被查,0.9941120743751526
65%应届毕业生求职最关注薪酬福利,0.009607136249542236
公司招聘称没有人成功是靠双休,0.9938819408416748
上官婉儿 太平公主,0.00868135690689087
苏炳添评论区变大型会诊现场,0.009394228458404541
油价,0.0097428560256958
李大钊生前唯一活动影像彩色修复,0.009179174900054932
北京东城发现一感染者,0.9938819408416748
87天女婴心脏比同龄人大3倍,0.010454118251800537
俄警告将打击乌境内所有西方武器,0.9931501746177673
北京近期142例感染者在10区,0.9852796792984009
为什么年纪轻轻也会有白发,0.9609504342079163
狗狗也不能笑着离开理发店,0.9940661191940308
男子坚持1年每天变花样给妻子做饭,0.01425015926361084
第五人格,0.009403586387634277
RA,0.008638203144073486
沉香如屑,0.9940568208694458
山东新增本土确诊8例均在济南,0.01134258508682251
吉林新增56例本土确诊,0.009450733661651611
每日添加糖摄入最好25g以下,0.010815739631652832
山东蓝翔校长女儿实名揭露合谋内幕,0.9941552877426147
4月27日新增本土确诊1494例,0.010644257068634033
重生之门反派智商,0.008953869342803955
河北新增本土无症状9例,0.6673699617385864
听清楚庄文杰听的是哪首周杰伦了,0.009335637092590332
当离异爸妈15年后再见面,0.9687051773071289
提升幸福感的20件小事,0.00914067029953003
NASA局长抱怨中国不主动提合作,0.9939867258071899
学了三年动画做的泡面广告,0.013225793838500977
秦皇岛海港区实施全域封控管理,0.011439263820648193
明日之后,0.010205328464508057
西藏拉萨首次拍到雪豹红外影像,0.010435223579406738
千万不要因为喜欢的男生而降低自己,0.015278041362762451
4月27日北京新增本土无症状2例,0.1797218918800354
爱情里的分寸感到底是什么,0.010898768901824951
农民大哥靠自学造出百辆机械战车,0.015621483325958252
4月27日新增确诊病例1503例,0.011199474334716797
杭州核酸检测免费,0.009650707244873047
陈坤 风起陇西,0.009274005889892578
教育部称取消初中后的普职分流是误读,0.9938866496086121
林奕含,0.008580923080444336
泰星tangmo死因系他人过失致死,0.9941940903663635
杭州48小时核酸,0.011084556579589844
北京大兴新增1例确诊病例,0.009838461875915527
冷空气明天南下长江中下游一带,0.01223897933959961
武警训练隔壁幼儿园小朋友成气氛组,0.010996997356414795
李大钊英勇就义95周年,0.009136617183685303
北京朝阳一中学已报告36名学生感染者,0.012712478637695312
她是真想让我们甩掉小肚腩,0.9840001463890076
高校连着4天给学生发4000只鸭腿,0.5944406390190125
妻子欲给男网友转50万丈夫气愤阻拦,0.9941889047622681
那些离开我们的TVB老戏骨,0.011741042137145996
北京独守车内男子接受总台央视记者采访,0.6595221161842346
且试天下有多甜,0.015101969242095947
陕西新增1例外省返回确诊病例,0.012242317199707031
北京飘雪夏天和冬天一键切换,0.009072422981262207
上海宝山3名干部因失职渎职被问责,0.9941739439964294
科学家开发出纸一样薄的扬声器,0.08000040054321289
关羽骑摩托车,0.00928044319152832
现实题材影视剧一定要卖惨吗,0.9941335320472717
重生之门弹幕,0.008695363998413086
网红主播的这些行为可能侵害了知识产权或构成不当竞争,0.994171679019928
暗恋一个人19年是什么体验,0.009408891201019287
张维为,0.008726418018341064
总有一天会和喜欢的人见面,0.008906185626983643
XYG锁定四强,0.011907398700714111
特斯拉回应北京机场高速事故,0.993999719619751
被毛茸茸的小鸭子可爱到了,0.00877469778060913
驾校教练都是阴阳大师吧,0.9941174983978271
统一城乡居民人身损害赔偿标准,0.019226789474487305
利物浦2比0比利亚雷亚尔,0.009973526000976562
港剧的魅力有多大,0.010140001773834229
月薪三千能买什么样的手机,0.010433435440063477
真的建议大家去趟故宫,0.008919298648834229
腾讯音乐回应网易云,0.009134113788604736
张译演技,0.008449316024780273
颜丙涛,0.010356903076171875
且试天下加更,0.008704304695129395
广东人最近别穿这些颜色衣服出街,0.012435495853424072
张译演技,0.008449316024780273
折叠手机的正确打开方式,0.00872737169265747
K宝生日当天获授勋,0.00859767198562622
当你有个没分寸感的室友,0.9936169385910034
重生之门 开门大吉,0.010641217231750488
白龙自愿退出,0.9940172433853149
特战荣耀,0.008668661117553711
秀豆的马可波罗,0.009402930736541748
XYG对战WE,0.00864863395690918
杭州常态化核酸检测政策相关问答,0.009710371494293213
9旬孤寡老人被民警照顾14年,0.9938938021659851
