keywords,score
习近平在广东考察调研,0.019119560718536377
初代跑男重聚,0.041439950466156006
王一博从ye到yue,0.031398653984069824
消博会开馆首日有哪些亮点,0.09539443254470825
游客举报淄博出租司机不打表多收5元,0.4758076071739197
卫健局回应男生高考体检被要求脱内裤,0.48346930742263794
鹿晗直播,0.065970778465271
陈都灵孙千撞衫,0.4031450152397156
娜扎异域神女造型,0.01654946804046631
口腔诊所借杨颖正畸案例宣传被罚,0.7085040211677551
BLG晋级MSI,0.07692718505859375
邓超晒跑男合照说weare伐木累,0.2889077067375183
长月烬明,0.14648526906967163
刘亚仁体内检出第5种毒品,0.14773601293563843
刘雯再登美国版VOGUE封面,0.010952770709991455
男子入职6分钟身亡被认定工亡,0.39725935459136963
王源演唱会广州站许可证,0.07820039987564087
马龙1比3林昀儒,0.0588526725769043
劣质衣服居然有致癌风险,0.9789313077926636
aespa妆造,0.09653377532958984
EDG,0.05063050985336304
高校图书馆非事业编岗位百人竞争,0.18745964765548706
韩国男爱豆小卡的手指甲,0.0127488374710083
章若楠齐刘海卷发,0.5755435228347778
真的要开始存钱了,0.7169414162635803
买了个五斤的芒果,0.09328246116638184
杨幂新剧,0.010463595390319824
长月烬明十二神全部陨落,0.3145800232887268
玄彬东京活动生图,0.039464712142944336
丫丫乐乐回国细节披露,0.11861056089401245
你会付费看网文吗,0.6452397108078003
淄博烧烤的热度能持续多久,0.011132657527923584
郑彩率去世,0.0580403208732605
台媒报道吴磊周雨彤吻戏,0.13954126834869385
男子让女店员帮试文胸遭怒怼,0.40981054306030273
欧冠,0.033538997173309326
冯小刚我人就在北京,0.042084693908691406
专家称年轻人不生小孩是不对的,0.3853517770767212
魔神是澹台烬,0.03184622526168823
Ale石头人五杀,0.26616519689559937
领馆提醒中国留学生勿代收不明快递,0.7712945938110352
陈晓新剧再穿女装,0.012797415256500244
李沁刘巧珍人生之路收官视频,0.01895350217819214
赵露思神隐杀青vlog,0.24127155542373657
leave,0.04381817579269409
仅1成多人拒绝下班秒回工作,0.8983669281005859
不要把工作当成天大的事,0.14259648323059082
李兰迪露背黑裙,0.179517924785614
长月烬明近三年仙侠剧第一,0.020803391933441162
当没车的人去超市购物,0.8158431053161621
SEVENTEEN新歌预告照,0.012302935123443604
发挥科技创新的支撑引领作用,0.013537704944610596
山东事业编,0.30107295513153076
顾曼丽被抓,0.058107852935791016
赵露思给手表打码,0.24045288562774658
突发疾病请假回家死亡算不算工伤,0.3274867534637451
张本智和止步冠军赛16强,0.06066983938217163
尘封十三载,0.03183615207672119
Elk好猛,0.046045660972595215
MSI,0.09473270177841187
罗云熙十二神合照,0.014154672622680664
活死人 团综招商中,0.4211019277572632
惊奇队长2首支预告,0.02847820520401001
CBA,0.06062597036361694
林昀儒晋级冠军赛8强,0.033148348331451416
南京沙尘暴,0.6699103713035583
孔雪儿的背部曲线,0.016023993492126465
隐形战队,0.030516743659973145
柳智敏金发首舞台,0.019186198711395264
灭族成桑酒心魔,0.0736151933670044
江疏影窦骁新剧吻戏,0.01247406005859375
姜涛曾获全球百大帅哥第五名,0.009048700332641602
马嘉祺学舞娘动作,0.03492814302444458
陈梦晋级冠军赛8强,0.03500533103942871
2023LPL春季赛季后赛,0.08432507514953613
墨西哥是全球上班时间最长国家,0.09312385320663452
文咏珊高颅顶盘发,0.2678518295288086
BLG对战EDG,0.01984095573425293
当你给妈妈说想辞职了,0.41643595695495605
双子座只会选择第一眼就心动的人,0.011242449283599854
假如热播剧男主在同一个群,0.2957846522331238
RAIN逃过了韩国酵母,0.037436068058013916
冥夜桑酒好哭,0.4173923134803772
小伙开车116公里去日照看日照金山,0.14622396230697632
半熟恋人2最终告白日,0.030382812023162842
上海的现实版莫奈花园,0.04896080493927002
张兰团队再现离职风波,0.0829419493675232
娄底宝马女司机承认第一时间知道撞人,0.38870686292648315
女孩思念去世父亲哭泣同学拥抱安慰,0.10075479745864868
中国有约,0.21020597219467163
中国科学家研讨在月球上盖房子,0.05286991596221924
网友跨城捐20万支持抗癌共享厨房,0.299949586391449
天欢好疯,0.1717667579650879
九城上演橙色灯光秀,0.03915029764175415
冥夜失明,0.5398778319358826
王菊 我的肚子很可爱,0.03387683629989624
外卖小哥写的诗,0.18197304010391235
怒呛人生 东亚人发疯实录,0.3200222849845886
入职第一天是不是都很尴尬,0.7986506819725037
西湖音乐节,0.05715024471282959
紧那罗典藏皮肤,0.13140630722045898
半熟恋人,0.044779300689697266
淄博烧烤的灵魂到底是什么,0.013358891010284424
狼队滔搏场下交手,0.32066231966018677
习近平总书记在广东考察调研,0.0307466983795166
张兰,0.03752100467681885
罗云熙陈都灵错位图,0.11493021249771118
薛之谦南京演唱会门票,0.05492442846298218
仙侠剧从未文学,0.04669219255447388
小米13Ultra订单增加50%,0.03591156005859375
李宇春龙丹妮跳舞镜头,0.05551224946975708
印度将成全球人口第一大国,0.05034506320953369
婚礼堵门1小时丈母娘吃2次救心丸,0.029392898082733154
虞书欣工作室发长文回应,0.06127500534057617
张杰谢娜因名誉权起诉中介,0.34263110160827637
许杨玉琢和法老是同一个家政阿姨,0.3245251774787903
员工上班摸鱼被辞退,0.7356289029121399
省吃俭用还能存到钱吗,0.44061529636383057
马嘉祺的图片排版,0.01259523630142212
宋茜绿发,0.17390239238739014
热烈制片人怒怼网友,0.5584990382194519
中方已做好迎接丫丫回国各项准备,0.32208019495010376
狗过马路也要等红绿灯,0.6678513288497925
以中国式现代化新成就为世界发展提供新机遇,0.021725475788116455
冯小刚分不清迪丽热巴和古力娜扎,0.20590102672576904
张凌赫个人工作室成立,0.01234525442123413
马嘉祺唱映山红,0.06858617067337036
武庚纪好宠任嘉伦,0.03768110275268555
狂飙麻子到薄冰遭老罪了,0.782111406326294
李惠仁金发,0.06050562858581543
两男子将涉黄小卡片发到警车车窗,0.33464425802230835
宋雨琦化妆视频,0.07269859313964844
全网都知道熊猫赖床了,0.712660551071167
小学生盘手串文具店直接卖疯了,0.20067143440246582
成毅李一桐新剧身高差,0.08705997467041016
熊猫花花学会障眼法了,0.022129178047180176
梁静茹演唱会上海站官宣,0.09549736976623535
沙尘暴,0.8250163793563843
2023KPL春季赛,0.08602339029312134
邓超腿艺人,0.06763678789138794
巴西总统将访华,0.04100722074508667
父母存得住钱的原因,0.04843670129776001
哈尔滨下雪,0.06665384769439697
小S二女儿侧拍照,0.056920647621154785
石楠花又腥又臭为何还大面积种,0.9483907222747803
四川烧烤板眼儿有好多,0.45895254611968994
原著里的冥夜桑酒,0.010175049304962158
在外滩撸一种很新的猫,0.00920015573501587
2023教资考试笔试成绩,0.04431635141372681
周冬雨慢镜头,0.09622061252593994
iPhone15Pro相机厚约2枚1元硬币,0.06448686122894287
大城市是小镇女生的避风港吗,0.4364531636238098
甲减都有哪些症状,0.22946947813034058
王菊肚子,0.2853962779045105
易烊千玺疑似出演英雄联盟网剧,0.1839456558227539
高校回应女生从宿舍楼坠落,0.31577056646347046
罗云熙威亚戏,0.06720328330993652
老乡鸡 我保证这次没有中间商赚差价,0.6715932488441467
法老 老乡鸡,0.32797491550445557
白鹿更喜欢冥夜,0.06224524974822998
如何缓解手机电量焦虑,0.030821621417999268
减肥失败后以为自己是甲减,0.5299915075302124
什么是失望性情感隔离,0.9689912796020508
诅咒叶夕雾的魔女是真的桑酒,0.057441115379333496
直井怜暂停活动,0.3433513045310974
德塔文认证罗云熙市场号召力,0.05912142992019653
四句话教你活出精彩,0.014927566051483154
一位日本女读者写的跨国信,0.5817428827285767
女子下班回复工作消息获赔加班费,0.366554319858551
马思纯进组后前后对比,0.040113210678100586
石楠花拿铁,0.1009225845336914
湖北一女局长被曝用公款配置休息室,0.3511396646499634
何超莲晒毕业照,0.14218157529830933
原神,0.00975865125656128
云逛消博会,0.36407870054244995
2个关键词看消博会广交会,0.2982625961303711
3年轻人20万开店日营业额仅79元,0.44585174322128296
虞书欣让粉丝不要再push工作人员,0.3581730127334595
郑州抗癌共享厨房面临关门困境,0.22471076250076294
苏州大学回应网传复试确认仅3分钟,0.557815670967102
长空之王雷宇片场旋转花絮,0.18660181760787964
罗云熙白鹿新浪扫楼预告,0.1080964207649231
热烈海报细节,0.016743361949920654
谁把熊猫晾这了,0.8638194799423218
Ravi退出VIXX,0.32610487937927246
娜扎江疏影曾给粉丝的回复,0.013216972351074219
桑酒被灭族,0.46377384662628174
明星和粉丝的关系,0.545590877532959
群众生育观念已转向少生优育,0.15346896648406982
喻言CHAMPION体育画报周年刊大片,0.018908977508544922
保利 如梦之梦,0.014699399471282959
陈伟霆汕头小公园宣传新电影,0.01149052381515503
卫健委回应出台政策鼓励早婚早育提案,0.33248692750930786
唐朝诡事录之西行全员布局,0.009247183799743652
冯小刚说公众人物只能骂不还口打不还手,0.4070902466773987
罗云熙说神魔大战拍了22天,0.12778717279434204
去年中国人看网文花了300多亿,0.1639573574066162
一个人也要活成一个春天,0.026413321495056152
长月烬明十二神归位,0.24842685461044312
爱很美味,0.02297574281692505
长月烬明流浪地球同一特效团队,0.29245835542678833
哪些人不能喝椰子水,0.5205041766166687
张艺兴张婧仪演兄妹,0.08729952573776245
笑果北京开业,0.12814831733703613
闫伟伦家暴丁漫漫,0.08742117881774902
比特币,0.13281476497650146
成龙刘浩存郭麒麟芭莎大片,0.03309071063995361
如梦之梦西安,0.0600818395614624
宝马女司机撞人拖行案开庭,0.2877810597419739
罗云熙双眼皮好多层,0.07814961671829224
郑晓龙评赵丽颖转型,0.07314598560333252
叶夕雾是黎苏苏的一缕恶魂,0.010416865348815918
李佳航泡温泉弄伤一根肋骨,0.526033341884613
喝预开口的椰子 进急诊,0.02516692876815796
那英狂飙后再唱OST,0.047576189041137695
淄博烧烤,0.11280518770217896
阿里所有产品将接入通义千问,0.5158581733703613
张杰官宣加盟青岛凤凰音乐节,0.10914486646652222
迪丽热巴到达贵阳,0.11510950326919556
极端天气公司该不该通知居家办公,0.4726591110229492
INTO1正装告别海报,0.04477989673614502
山东成五一国内游顶流,0.1839962601661682
张元英安宥真再现摔倒名场面,0.02908092737197876
莎拉和小妍珍或将合作新剧,0.01448732614517212
当粉丝不让你质疑演技的时候,0.3559234142303467
iPhone15屏幕将使用M12材料,0.0969666838645935
大侦探8明日之战高清剧照,0.021238207817077637
淄博不止有烧烤,0.3373028635978699
SEVENTEEN新专史上强度最高编舞,0.010288596153259277
谁家小狗吵架扮鬼脸啊,0.4347020387649536
中国球员的时尚触觉,0.01331263780593872
金晨说今天这风差点把狗吹走,0.33035391569137573
苹果iPhone15Pro机模曝光,0.28628039360046387
柯南贝克街的亡灵全国上映,0.008232355117797852
大侦探,0.01458585262298584
iOS15.7.5正式版发布,0.027491331100463867
年轻人创业之前该审视自己,0.014205753803253174
黄明昊极限挑战拍摄花絮,0.021930932998657227
王一博热烈找镜头,0.0108603835105896
原生家庭对个人来说太重要了,0.05343282222747803
为什么说牡丹是大自然的修图工具,0.5454509258270264
北有沙尘暴南有回南天,0.5292177796363831
芋泥凤凰奶糊,0.11823737621307373
黎苏苏是最后一个神,0.010485529899597168
受小朋友欢迎的狗狗长这样,0.34687137603759766
iOS16.4.1尚未修复续航问题,0.37809497117996216
抢抓战略机遇增强发展信心,0.010894834995269775
杨丞琳献唱陈飞宇周也新片主题曲,0.011204838752746582
石楠花的花语 yue,0.09528285264968872
男子邀异性游三亚钱全包妻子起诉索回,0.30054616928100586
上海沙尘暴,0.556374728679657
女子看直播一次性公款打赏三四十万,0.3066473603248596
大鹏导演新片热烈定档,0.008562028408050537
被当街踹倒女子好友发声,0.5136514902114868
张凯丽维权胜诉,0.22852599620819092
比亚迪,0.16171854734420776
有这8种症状需警惕帕金森病,0.10859191417694092
长月烬明登陆韩国大屏,0.07437705993652344
男子痴迷炼金术6次偷拆他人汽车,0.2013171911239624
十年前的追星手账,0.4423474073410034
任嘉伦超话会掉落Q版任嘉伦,0.6071059703826904
当香港人在东北买水果时,0.6938830018043518
全聚德连亏三年,0.8206730484962463
变质的椰子会产生椰毒假单胞菌,0.8957934975624084
澹台烬的乌鸦太嚣张了,0.21897482872009277
从校园到社会的友情,0.015625298023223877
陈都灵天欢绕腕好带感,0.03497970104217529
比亚迪云辇系统,0.09731602668762207
热烈,0.06154322624206543
石楠花竟然可以吃,0.09477168321609497
赵露思与替身合照,0.02352726459503174
假装上班能缓解待业焦虑吗,0.13679933547973633
95后海警执法员缉私战斗中牺牲,0.23826509714126587
冥夜救初凰也是在救黎苏苏,0.07920008897781372
吃土,0.7208015322685242
如何分辨椰子水坏没坏,0.045414507389068604
迪丽热巴进组,0.1537514328956604
跟老爸说买了墓地旁边的房子,0.03212404251098633
陈鑫海公司名字叫好虚荣,0.3451851010322571
环台岛演习72小时,0.057827115058898926
官方通报景点奶茶店使用霉变竹筒,0.7110632658004761
同居不同房的情侣是怎样的,0.19192743301391602
因家长决策失误而耽误过大事,0.2684898376464844
妍珍越来越甜了,0.24307018518447876
南京紫峰广场内一女子从中庭坠落身亡,0.3362605571746826
吴彤去看华晨宇的演唱会了,0.013476192951202393
为什么有人上班可以很快乐,0.2573719024658203
没点才艺都不配哄娃了吗,0.8835089206695557
你怎么看年轻人更愿意搞钱,0.3309236764907837
五一当天三倍工资你愿意加班吗,0.3998423218727112
网购别再只会看销量了,0.9255238175392151
陈晓说愿意演渣男,0.42151814699172974
高加林终于知道顶替真相,0.01018381118774414
杨颖早期素颜花絮视频,0.03511321544647217
天津沙尘暴,0.5643919110298157
白鹿影视资源,0.01434105634689331
蒋依依红毯拍照把裙尾扯掉了,0.5410289764404297
灌篮高手中国首映礼官宣,0.052408814430236816
戈贝尔被禁赛一场,0.37149494886398315
法考,0.04724419116973877
WBG官宣easyhoon离队,0.3874785304069519
原来熊猫也喜欢看热闹,0.03265273571014404
权志龙许允真中村一叶合照,0.024137556552886963
云南烧烤申请出战,0.2083161473274231
高加林高双星人生再次互换,0.11867207288742065
Angelababy相思令拍摄花絮照,0.03475135564804077
9句话帮你遇见更好的自己,0.023292243480682373
无刺榴莲,0.03552204370498657
白敬亭的翻包好物,0.013482809066772461
沙尘暴 柳絮,0.8371704816818237
比亚迪发布会,0.1694546937942505
聚焦第三届消博会,0.059796035289764404
虞书欣泳衣旧照,0.019137024879455566
北京沙尘暴,0.6553929448127747
接受了永别却没忍住思念,0.05028277635574341
石楠花好臭,0.877600371837616
人生之路大结局,0.03225737810134888
陈鑫海二公子,0.3699510097503662
热门歌手演唱会人头数,0.030253231525421143
今年五一实际只放一天,0.7285447120666504
淄博政府反应也好快,0.0530509352684021
瘫痪女童复健3年能骑自行车了,0.0611414909362793
秦岚暴打渣男柠檬茶,0.3626229763031006
长月烬明原著,0.012780308723449707
徐明浩cos怪盗基德,0.09147888422012329
陈都灵说天欢和谁都没隔夜仇,0.041773855686187744
长月烬明神魔大战,0.06571453809738159
罗云熙打戏,0.4182882308959961
网友P瘦了的沈腾,0.34130895137786865
折一条裤子可以有多快,0.38439977169036865
陈晓陆行知定妆花絮,0.07069641351699829
潘粤明消失的十一层合照,0.021877527236938477
湖南邵阳警方通报男子当街踹倒女子,0.3708767294883728
恋综cp都在长沙红人节合体了,0.0498775839805603
ive新歌和你xx的适配度,0.013067305088043213
KnowKnow道歉,0.3272843360900879
杨幂关雪定妆照,0.04592400789260864
多个商家注册竹筒奶茶店,0.36778414249420166
长空之王雷宇和父母对话好心酸,0.01849687099456787
网剧藏药令杀青,0.2981839179992676
长月烬明预告,0.2158241868019104
叶舒华 喜欢赚钱,0.033653199672698975
薄冰全员替身文学,0.03929543495178223
金智秀说我是你们的宝宝,0.10624825954437256
城市巡游记,0.029196858406066895
竹筒奶茶 发霉,0.9338889718055725
陈晓新剧收视率持续破3,0.06102752685546875
吴磊的小鸟依人,0.02602243423461914
江宁路,0.16510576009750366
上海一写字楼内1人被捅伤身亡,0.6210317611694336
孙怡谈这一年的变化,0.009521842002868652
你是什么门,0.912764310836792
