keywords,score
农村特色产业前景广阔,0.02222573757171631
王者荣耀,0.22535401582717896
北京人均存款已接近27万,0.6024184823036194
中国有约,0.21020597219467163
社保挂靠代缴已被明确为违法,0.6848931312561035
王者荣耀东方来客新赛季,0.1076359748840332
陈都灵 电子木鱼,0.13708049058914185
不要穿试衣间里的鞋,0.6935039162635803
春天是精神病的高发时期,0.018028438091278076
美生物实验室感染病毒的小白鼠逃了,0.34398871660232544
六公主谈柯南争议,0.08310109376907349
添添,0.1656886339187622
魏大勋坐在机场回复粉丝,0.10791319608688354
杨紫吃的什么面,0.6090036630630493
蛟蚌分离,0.8752231001853943
偶遇虞书欣蹲在垃圾桶旁,0.31412845849990845
长月烬明 烬门,0.3019087314605713
感觉全网中了flower的毒,0.6387696266174316
白鹿能不能再演十集反派,0.03042811155319214
丈夫隐瞒性功能障碍被起诉撤销婚姻,0.4093037247657776
身体出现小毛病的真实原因,0.012398719787597656
女儿出首付母亲买房后把产权给儿子,0.20883995294570923
90所大学撤销公共事业管理专业,0.35859203338623047
欢门,0.08125060796737671
特斯拉降价,0.7257066965103149
减肥对外貌的改变可以有多大,0.04653966426849365
张杰说西安的你们懂我吗,0.44325166940689087
75岁施瓦辛格发上街修路视频,0.20167553424835205
为什么年轻人热衷考教资,0.02280104160308838
彭小苒新剧红色婚服,0.052321791648864746
王源上海演唱会许可证,0.10250216722488403
美香添添小崽要一起回家,0.16369152069091797
刀我别用薄冰刀,0.7521377801895142
终于等到榴莲大降价,0.6673431396484375
齐思钧直播,0.040177226066589355
半熟恋人 老孙,0.11553996801376343
王者荣耀S31赛季延迟更新,0.15211433172225952
两女子吃自助打包400元食材被拘,0.6259745955467224
宋雨琦奔跑吧拍摄花絮,0.11785334348678589
宋茜短发齐刘海,0.040567636489868164
余春羊欢迎陈浅加入组织,0.15814244747161865
女演员称怀孕后丈夫多次收涉黄短信,0.11729508638381958
KPOP追星最后悔三件事,0.4191920757293701
董洁说飞天不是一个人是一群人,0.03309798240661621
电商主播年薪千万降到年薪百万,0.42864513397216797
flower,0.07628190517425537
开车出门千万要看好油表,0.33796942234039307
长月烬明,0.14648526906967163
故宫门票,0.06111234426498413
李卿说最后只有陈哲是单身,0.051525115966796875
王者新赛季,0.034329891204833984
习近平到南部战区海军视察调研,0.014112532138824463
冥夜桑酒BE真的太合理了,0.15270119905471802
罗云熙BJD娃娃,0.23879599571228027
减肥的人晚上都在吃什么,0.17828983068466187
专家称应探索劳动强度与报酬对价模式,0.07410484552383423
徐璐跳了flower,0.48227137327194214
张柏芝路透状态,0.13136446475982666
爱情而已,0.14081746339797974
蔡徐坤晒黑白海边花絮照,0.2495068907737732
谭松韵海洋馆随拍,0.04183471202850342
中了一千万还去上班吗,0.7341070175170898
TTG,0.10630142688751221
亲亲您这个什么您心里不清楚吗,0.6134482622146606
冥夜说和桑酒没分,0.6448739171028137
极氪X,0.4152284860610962
男子分手后花一年时间减掉60斤,0.03363955020904541
安永,0.024301588535308838
Liz高音,0.13534224033355713
雎晓雯怀孕做瑜伽,0.03683817386627197
给豪华品牌打个样,0.5657021403312683
宋三川梁友安都戴了婚戒,0.039548635482788086
爱情而已是汪汪队石锤,0.174943208694458
吴磊练习网球花絮,0.05460768938064575
中方对马克龙表态遭美批评不感到惊讶,0.39903724193573
王鹤棣白衬衣直播造型,0.07912373542785645
蔡徐坤收到小学生送的奥特曼卡,0.09732609987258911
极氪发布会,0.29058724641799927
爱情而已带火网球热,0.35061490535736084
樊振东3比1李尚洙,0.05079376697540283
卢拉访华,0.030078470706939697
官方发布预防新冠佩戴口罩指引,0.06416380405426025
看爱情而已大结局belike,0.0853922963142395
迪丽热巴开机图,0.10041159391403198
长月烬明预告,0.2158241868019104
这是在暗示你可以提涨薪了,0.42725294828414917
你们公司是不招双眼皮吗,0.8349830508232117
杨紫琼带小金人扫墓,0.01139688491821289
金智秀flower宠物开花舞,0.05403631925582886
半熟恋人,0.044779300689697266
风箫戈娅MVP,0.28342145681381226
看税收走基层,0.07524460554122925
长月烬明天欢下线,0.2948513627052307
李金铭曾参加节目被要求当儿媳,0.011480152606964111
罗云熙说搞点邪骨778,0.01193380355834961
女子醉酒后在酒店遭两次性侵,0.4284137487411499
名侦探柯南,0.013040006160736084
杨幂卷发,0.384402871131897
宋三川男友视角vlog,0.05488598346710205
澹台烬带叶夕雾拜见母亲,0.17251771688461304
孔雪儿的肩,0.10261595249176025
京城大师赛,0.12480980157852173
RW战胜DRG,0.010506153106689453
独居未婚中年男子去世10天后被发现,0.28551411628723145
桑酒有什么错呢她只是想吃全蛇宴,0.1089826226234436
教资,0.0367087721824646
余陶然孙沐雨终于抱了,0.03161698579788208
男子回乡养病意外带全村致富,0.10010266304016113
皇马VS切尔西,0.0823444128036499
林诗栋3比0邱党,0.06376796960830688
发挥科技创新的支撑引领作用,0.013537704944610596
叫耿植的男孩获反诈小能手称号,0.3581657409667969
韩国米诺地尔,0.16181939840316772
漳州万达砍人男子已被控制,0.5236219763755798
天欢认罪,0.5115330219268799
长月烬明算爆了吗,0.5716731548309326
网店售三寸金莲缠足袜299一双,0.6294359564781189
罗云熙35了,0.29629379510879517
外交部回应马克龙涉台表态遭美批评,0.4580734968185425
警方通报漳州万达砍人案,0.3589620590209961
小伙年会喜提365天带薪休假,0.2683762311935425
假如你中了1000万,0.4308895468711853
季曼逃婚,0.030323565006256104
徐艺洋暧昧时期聊天都能上头,0.021993041038513184
科学家的休假时间都在做什么,0.031956613063812256
老默死而复生会发生什么,0.32302629947662354
丁克的我想通了生孩子的意义,0.018973350524902344
南京26年前特大抢劫杀人案告破,0.29757165908813477
炸店是对无辜消费者的伤害,0.8802899122238159
陈卓璇写藏头诗,0.012590587139129639
减肥食谱一日三餐,0.03612375259399414
四川鸳鸯除了锅还有面,0.5971366763114929
习近平在茂名市考察调研,0.025380432605743408
从中国空间站看祖国大地勃勃生机,0.015574812889099121
警方回应女生劝阻女子带男孩进更衣室遭打,0.4242696166038513
毕业第一份工作月薪需要多少,0.020790457725524902
白鹿拿的手机支架是陈星旭小时候,0.46428847312927246
王楚钦 达科,0.06953668594360352
大城市户口真的重要吗,0.12938791513442993
杨紫泰国随拍,0.05072653293609619
丁克族们后来都怎么样了,0.34474605321884155
张凌赫主页是贝壳,0.048581838607788086
车银优韩素希同框,0.18642288446426392
马嘉祺被那英吐槽像下岗工人,0.24881857633590698
孙珍妮跳了flower,0.2914964556694031
丁程鑫用手护着娜扎,0.03149312734603882
天猫预测五一户外新趋势,0.040549635887145996
广西一高校被曝送学生进厂打螺丝,0.6035306453704834
生孩子会带给你什么,0.07490092515945435
柳智敏的比例,0.010598480701446533
王楚然打卡淄博烧烤,0.09831833839416504
校方要求学生外出实习是否必要,0.3156616687774658
NBA,0.03379088640213013
李彩演新歌KNOCK,0.012770771980285645
DRG对战RW,0.023822009563446045
LPL十周年主题片,0.011283814907073975
招惹 纯爱战士应声倒地,0.3615102171897888
女子疯狂网上购物确诊帕金森,0.40132319927215576
泰国坠崖孕妇仍无法离婚,0.297050416469574
王岳伦陪王诗龄拍汉服写真,0.01072227954864502
商务部对台进行贸易壁垒调查,0.3785552382469177
马丽拍人生路不熟串戏独行月球,0.0824475884437561
讨厌没有边界感的情侣,0.5249115228652954
天欢被处雷刑,0.49043798446655273
李莎旻子一天打两份工,0.41400736570358276
冥夜赦免了天欢,0.22261852025985718
大象吃香蕉总共分几步,0.44444823265075684
WTT新乡冠军赛2023,0.06355971097946167
00后网红马若松遭遇车祸身亡,0.2491699457168579
老道 东吉,0.04600554704666138
也不知道谁给我妈下的任务,0.4311559796333313
朱洁静喊曾可妮原名,0.04704093933105469
95后复原女性发型史为粉发女孩发声,0.279172420501709
严浩翔极挑白西装造型路透,0.04255056381225586
唐朝诡事录,0.010929226875305176
LPL十大选手定妆照,0.023784279823303223
荠菜鲜肉生煎,0.13914352655410767
游戏里的时尚妆容,0.01546400785446167
习近平总书记在广东省考察调研,0.049588143825531006
消博会开馆首日有哪些亮点,0.09539443254470825
专家称北京打车太便宜应涨价,0.23472940921783447
罗云熙的角色我分清了,0.16032320261001587
高校回应被指强迫学生实习,0.41361939907073975
长月烬明 吾学,0.1137886643409729
澹台烬玲娜贝儿cp名,0.18653053045272827
陈建斌夸陈晓有演员的美德,0.013734757900238037
不生孩子的想法会随着年龄改变吗,0.04084843397140503
男子被捅后趴在地上淡定玩手机,0.4063537120819092
有必要和朋友说真实收入吗,0.3155856728553772
杨幂新剧演女间谍,0.012337148189544678
长月烬明的剪辑,0.014975309371948242
用流浪地球打开长月烬明,0.27984434366226196
喜欢你我也是,0.10782420635223389
云南吃菌菇火锅店员取汤留样,0.5355283617973328
异地工作你会考虑迁户口吗,0.35343581438064575
90后男生拿到京户离职被公司追偿,0.456448495388031
我的胃只有两种状态,0.4861298203468323
小米,0.073627769947052
长佩,0.1437632441520691
男子骑偷来电动车被相亲对象认出,0.33846521377563477
明日方舟,0.06474268436431885
在火之前的淄博吃烧烤是一种什么体验,0.20851904153823853
杨贤硕二审被求判刑三年,0.11224955320358276
罗云熙白鹿长月烬明新浪扫楼,0.19896256923675537
张凌赫高得好突出,0.031199932098388672
长月烬明云合播放量新高,0.06578260660171509
Angelababy说在奔跑吧等你,0.2456890344619751
冥夜桑酒竹林剧照,0.16750943660736084
郑恺说其实我早就做好准备了,0.009208202362060547
快乐小分队花样人生视频,0.2573440670967102
张艺谋说满江红票房让他很意外,0.008242666721343994
迪丽热巴说无论你在哪都要带你回家,0.041042447090148926
施罗德绝杀,0.052344441413879395
国台办否认大陆有意赠台大熊猫,0.6483724117279053
杨幂新剧开机路透,0.01551520824432373
白玉兰奖提名预测,0.05278360843658447
平台回应网售三寸金莲缠足鞋袜,0.37064528465270996
奔跑吧11奇幻旅程主题海报,0.07703036069869995
湖人季后赛对阵灰熊,0.09365177154541016
什么原因阻碍了你生小孩,0.37936103343963623
没什么人做但很赚钱的工作,0.3977721929550171
最期待入围白玉兰的网剧,0.008115053176879883
直井怜手写信,0.42238372564315796
习近平在广东考察调研,0.019119560718536377
球迷追买中超球票,0.0280914306640625
今天好多剧开机,0.47606968879699707
拉塞尔不愧为水拉,0.02500683069229126
赞多说在准备惊喜你们一定要来,0.08256089687347412
向懒羊羊学习,0.023556232452392578
7名获救被拐儿童全网寻亲,0.1537097692489624
张兰招聘高学历主播,0.02464193105697632
奔跑吧第十一季定档,0.03210371732711792
冥夜真身地包天,0.3741486072540283
湖人战胜森林狼,0.032158076763153076
浙江多地严重污染,0.9278345704078674
招惹,0.6284216046333313
马若松父亲发声,0.08068913221359253
李凯尔回应中国男篮归化,0.12024670839309692
让全外网网友们爆炸震惊的男人,0.2980458736419678
巴西总统访华,0.03175652027130127
森林狼vs湖人,0.11574423313140869
INTO1上海演唱会官宣,0.18519222736358643
白鹿想和杨幂互换衣橱,0.04110586643218994
贾乃亮生日带罕见病儿童出游,0.01463329792022705
专家称年轻人不生小孩是不对的,0.3853517770767212
罗云熙扫楼被送乌鸦,0.5467855334281921
湖人森林狼加时,0.20483112335205078
为什么你到现在还没谈恋爱,0.3970355987548828
李沐宸旗袍造型,0.04663187265396118
李宇春新歌鸵鸟逃跑了预告,0.03771090507507324
为什么感觉领导都很有精神,0.021997034549713135
爱德华兹9分,0.03791099786758423
浓眉致命犯规,0.26644420623779297
朴叙俊出演惊奇队长老公,0.057507216930389404
詹姆斯传球,0.17552334070205688
小伙被公司发配到乡镇惹网友羡慕,0.012063801288604736
法国续租大熊猫欢欢和圆仔,0.06363767385482788
极限挑战全员上班路透,0.09852850437164307
MetGala拟邀嘉宾名单,0.08072257041931152
光与夜之恋,0.05383533239364624
原神3.6版本更新 纳西妲,0.02191781997680664
关晓彤曾说谁会闲的花七万买包,0.09272778034210205
年轻人不结婚不生娃反促进宠物经济,0.2445662021636963
冯绍峰王丽坤新电影演夫妻,0.044338881969451904
淄博老板娘为赶高铁小伙1V1烤串,0.26509761810302734
专家建议有实力有担当的人多生孩子,0.29026728868484497
虞书欣去了洛杉矶环球影城,0.03521329164505005
利剑玫瑰全阵容官宣,0.04578739404678345
中国网友韩国偶遇崔显旭,0.1548067331314087
沙尘暴,0.8250163793563843
沈阳三孩家庭每月发500元至孩子3岁,0.3746635913848877
桑酒的必杀技,0.011054456233978271
阿凡达2取景地,0.03972458839416504
原神3.6,0.011875152587890625
香菜热狗肠,0.1261281967163086
金世佳说无论你在哪里都要带你回家,0.011296987533569336
原来猫咪也有法令纹,0.10101372003555298
推特并入X公司,0.5419747829437256
长月烬明微博开分7.3,0.24915599822998047
格莱美慢镜头,0.1109434962272644
周三的精神状态,0.011070311069488525
原来驾校教练都是杠精,0.012119293212890625
原神纳西妲,0.048408329486846924
南京大屠杀幸存者郑锦阳逝世,0.11845600605010986
成都草莓音乐节一男子对警察竖中指,0.2990124225616455
是时候换台电车了,0.1121411919593811
去年国内人均存款增加1.2万,0.05064427852630615
Lisa将参与太阳新专辑,0.01751190423965454
韩素希紫色毛衫,0.07223695516586304
为什么大家反感专家,0.610494077205658
山东事业编,0.30107295513153076
专家称子女是长周期的耐用消费品,0.03543698787689209
菩提祖师才是悟空唯一的师父,0.010952413082122803
撒贝宁台下认真做笔记,0.01231616735458374
男子为养近200只猫雇4人轮班照顾,0.19083738327026367
NBA附加赛,0.0352780818939209
网友在泰国偶遇杨紫,0.10641354322433472
网红路牌为什么不网红了,0.6240731477737427
老鹰扑灭热火,0.30012792348861694
利剑玫瑰开机路透,0.10918039083480835
陈都灵孙千撞衫,0.4031450152397156
周深说一起开跑收获超高分贝的快乐,0.009972035884857178
第五人格五周年,0.018560349941253662
内娱最强男腰精,0.10483580827713013
习近平总书记在广东考察调研,0.0307466983795166
熙米鹿,0.09270668029785156
利剑玫瑰,0.09843385219573975
电锯人,0.041959524154663086
剑网3,0.05875265598297119
人生路不熟预售开启,0.05465179681777954
INTO1新歌不说再见上线,0.04535031318664551
冥夜被煮,0.681641697883606
冥夜桑酒 哑巴爱情,0.334322988986969
邓超晒跑男合照说weare伐木累,0.2889077067375183
熊猫宝宝吓到奶瓶都扔了,0.7294499278068542
买了个五斤的芒果,0.09328246116638184
ENHYPEN确定5月回归,0.07048684358596802
本轮沙尘已跨过长江,0.7524851560592651
农妇因信访被控寻衅滋事,0.3875391483306885
劣质衣服居然有致癌风险,0.9789313077926636
高校图书馆非事业编岗位百人竞争,0.18745964765548706
男子让女店员帮试文胸遭怒怼,0.40981054306030273
王一博从ye到yue,0.031398653984069824
哈兰德纪录收割机,0.0636712908744812
鹿晗直播,0.065970778465271
游客举报淄博出租司机不打表多收5元,0.4758076071739197
LESSERAFIM新专预告图,0.07844877243041992
白鹿二搭定律,0.01223224401473999
第一次接触到小朋友的烦恼,0.05704009532928467
上班摸鱼会影响工作吗,0.2690454125404358
韩国男爱豆小卡的手指甲,0.0127488374710083
娜扎异域神女造型,0.01654946804046631
曼城3比0拜仁,0.07633167505264282
耿爽在安理会点名某军事大国,0.25746142864227295
初代跑男重聚,0.041439950466156006
卫健局回应男生高考体检被要求脱内裤,0.48346930742263794
王俊凯艺术晚宴花絮,0.03840869665145874
杨幂新剧,0.010463595390319824
台媒报道吴磊周雨彤吻戏,0.13954126834869385
瘫痪女童复健3年能骑自行车了,0.0611414909362793
BLG晋级MSI,0.07692718505859375
EDG,0.05063050985336304
中方回应美方寻求重新安排布林肯访华,0.36036503314971924
玄彬东京活动生图,0.039464712142944336
刘亚仁体内检出第5种毒品,0.14773601293563843
长月烬明十二神全部陨落,0.3145800232887268
曼城vs拜仁,0.08923542499542236
怎么判断自己是骨架大还是胖,0.33424919843673706
真的要开始存钱了,0.7169414162635803
冯小刚我人就在北京,0.042084693908691406
刘雯再登美国版VOGUE封面,0.010952770709991455
不要把工作当成天大的事,0.14259648323059082
姜涛曾获全球百大帅哥第五名,0.009048700332641602
男子入职6分钟身亡被认定工亡,0.39725935459136963
郑彩率去世,0.0580403208732605
欧冠,0.033538997173309326
丫丫乐乐回国细节披露,0.11861056089401245
魔神是澹台烬,0.03184622526168823
高诗岩,0.021088719367980957
追星要有边界感,0.0887380838394165
马龙1比3林昀儒,0.0588526725769043
SEVENTEEN新歌预告照,0.012302935123443604
章若楠齐刘海卷发,0.5755435228347778
赵露思给手表打码,0.24045288562774658
该如何反击造自己黄谣的人,0.12568509578704834
leave,0.04381817579269409
aespa妆造,0.09653377532958984
王源演唱会广州站许可证,0.07820039987564087
没有回不了消息的人,0.8255004286766052
口腔诊所借杨颖正畸案例宣传被罚,0.7085040211677551
Ale石头人五杀,0.26616519689559937
